{
    "name": "Sepia",
    "blur_strength": 6,
    "main_text_color": "rgba(100, 70, 50, 1)",
    "italics_text_color": "rgba(120, 85, 65, 1)",
    "underline_text_color": "rgba(80, 55, 35, 1)",
    "quote_text_color": "rgba(140, 100, 70, 1)",
    "blur_tint_color": "rgba(160, 130, 100, 0.9)",
    "chat_tint_color": "rgba(180, 150, 120, 0.95)",
    "user_mes_blur_tint_color": "rgba(170, 140, 110, 0.8)",
    "bot_mes_blur_tint_color": "rgba(165, 135, 105, 0.8)",
    "shadow_color": "rgba(60, 40, 25, 0.5)",
    "shadow_width": 4,
    "border_color": "rgba(140, 100, 70, 0.9)",
    "font_scale": 1.0,
    "fast_ui_mode": false,
    "waifuMode": false,
    "avatar_style": 0,
    "chat_display": 0,
    "noShadows": false,
    "chat_width": 70,
    "timer_enabled": false,
    "timestamps_enabled": true,
    "timestamp_model_icon": false,
    "mesIDDisplay_enabled": false,
    "hideChatAvatars_enabled": false,
    "message_token_count_enabled": false,
    "expand_message_actions": false,
    "enableZenSliders": true,
    "enableLabMode": true,
    "hotswap_enabled": true,
    "custom_css": "/* Sepia - Dark Vintage Theme */\nbody {\n    color: rgba(100, 70, 50, 1);\n    background-color: rgba(180, 150, 120, 0.95);\n    background-attachment: fixed;\n    overflow-x: hidden;\n}\n\n/* Dark vintage sepia background */\nbody {\n    background: \n        radial-gradient(circle at 20% 80%, rgba(140, 110, 80, 0.4) 0%, transparent 60%),\n        radial-gradient(circle at 80% 20%, rgba(120, 90, 60, 0.4) 0%, transparent 60%),\n        linear-gradient(135deg, rgba(180, 150, 120, 0.95), rgba(160, 130, 100, 0.9));\n    background-size: 100% 100%, 100% 100%, 100% 100%;\n    position: relative;\n}\n\n/* Add vintage paper texture overlay */\nbody::before {\n    content: '';\n    position: fixed;\n    inset: 0;\n    background-image: \n        radial-gradient(circle at 1px 1px, rgba(100, 70, 50, 0.2) 1px, transparent 0),\n        linear-gradient(45deg, transparent 48%, rgba(120, 90, 60, 0.1) 49%, rgba(120, 90, 60, 0.1) 51%, transparent 52%);\n    background-size: 15px 15px, 30px 30px;\n    opacity: 0.4;\n    pointer-events: none;\n    z-index: 1;\n}\n\n/* Dark vintage message bubbles */\n.mes, .mesText, .swipe-message {\n    background: linear-gradient(135deg, rgba(170, 140, 110, 0.9), rgba(165, 135, 105, 0.8));\n    border: 3px solid rgba(140, 100, 70, 0.9);\n    box-shadow: \n        0 6px 16px rgba(60, 40, 25, 0.4),\n        inset 0 2px 4px rgba(200, 180, 160, 0.3);\n    backdrop-filter: blur(6px);\n    border-radius: 15px;\n    transition: all 0.3s ease;\n    position: relative;\n    z-index: 2;\n}\n\n.mes:hover {\n    background: linear-gradient(135deg, rgba(165, 135, 105, 0.95), rgba(160, 130, 100, 0.9));\n    box-shadow: \n        0 8px 20px rgba(60, 40, 25, 0.5),\n        inset 0 2px 4px rgba(200, 180, 160, 0.4);\n    transform: translateY(-3px);\n}\n\n/* Dark vintage code blocks */\n.chat_mes_block .mes_text p code {\n    background: rgba(120, 90, 60, 0.6);\n    color: rgba(200, 180, 160, 1);\n    border-radius: 8px;\n    padding: 4px 10px;\n    border: 2px solid rgba(140, 100, 70, 0.7);\n    font-family: 'Courier New', monospace;\n    box-shadow: inset 0 2px 4px rgba(60, 40, 25, 0.3);\n}\n\n/* Dark vintage quote styling */\n.chat_mes_block .mes_text blockquote {\n    border-left: 5px solid rgba(140, 100, 70, 0.9);\n    background: rgba(160, 130, 100, 0.4);\n    padding-left: 20px;\n    border-radius: 8px;\n    font-style: italic;\n    position: relative;\n    box-shadow: inset 0 2px 4px rgba(60, 40, 25, 0.2);\n}\n\n.chat_mes_block .mes_text blockquote::before {\n    content: '\"'; \n    font-size: 2.5em;\n    color: rgba(140, 100, 70, 0.8);\n    position: absolute;\n    left: 8px;\n    top: -8px;\n    font-family: serif;\n    text-shadow: 2px 2px 4px rgba(60, 40, 25, 0.3);\n}\n\n/* Dark vintage input area */\n#send_textarea {\n    background: rgba(180, 150, 120, 0.9);\n    border: 3px solid rgba(140, 100, 70, 0.9);\n    color: rgba(100, 70, 50, 1);\n    border-radius: 10px;\n    box-shadow: inset 0 3px 6px rgba(60, 40, 25, 0.3);\n    font-family: 'Times New Roman', serif;\n    font-size: 1.1em;\n}\n\n#send_textarea:focus {\n    border-color: rgba(120, 85, 65, 1);\n    box-shadow: \n        0 0 10px rgba(120, 85, 65, 0.4),\n        inset 0 3px 6px rgba(60, 40, 25, 0.3);\n}\n\n/* Dark vintage button styling */\nbutton, .button {\n    background: linear-gradient(135deg, rgba(170, 140, 110, 0.9), rgba(165, 135, 105, 0.8));\n    border: 3px solid rgba(140, 100, 70, 0.9);\n    color: rgba(100, 70, 50, 1);\n    border-radius: 10px;\n    transition: all 0.3s ease;\n    box-shadow: 0 4px 8px rgba(60, 40, 25, 0.3);\n    font-family: 'Times New Roman', serif;\n    font-weight: bold;\n}\n\nbutton:hover, .button:hover {\n    background: linear-gradient(135deg, rgba(165, 135, 105, 0.95), rgba(160, 130, 100, 0.9));\n    border-color: rgba(120, 85, 65, 1);\n    box-shadow: 0 6px 12px rgba(60, 40, 25, 0.4);\n    transform: translateY(-2px);\n}\n\n/* Dark vintage sidebar */\n.sidebar {\n    background: rgba(180, 150, 120, 0.95);\n    border-right: 4px solid rgba(140, 100, 70, 0.9);\n    box-shadow: 3px 0 12px rgba(60, 40, 25, 0.3);\n}\n\n/* Dark vintage selection highlight */\n::selection {\n    background: rgba(140, 100, 70, 0.6);\n    color: rgba(200, 180, 160, 1);\n}\n\n/* Dark vintage scrollbar */\n::-webkit-scrollbar {\n    width: 12px;\n}\n\n::-webkit-scrollbar-track {\n    background: rgba(160, 130, 100, 0.8);\n    border-radius: 6px;\n    border: 1px solid rgba(140, 100, 70, 0.5);\n}\n\n::-webkit-scrollbar-thumb {\n    background: rgba(140, 100, 70, 0.9);\n    border-radius: 6px;\n    border: 2px solid rgba(120, 85, 65, 0.7);\n    box-shadow: inset 0 2px 4px rgba(60, 40, 25, 0.3);\n}\n\n::-webkit-scrollbar-thumb:hover {\n    background: rgba(120, 85, 65, 0.9);\n}\n\n/* Dark vintage links */\na {\n    color: rgba(120, 85, 65, 1);\n    text-decoration: underline;\n    text-decoration-color: rgba(140, 100, 70, 0.8);\n    font-weight: bold;\n}\n\na:hover {\n    color: rgba(100, 70, 50, 1);\n    text-decoration-color: rgba(120, 85, 65, 1);\n}\n\n/* Dark vintage headers */\nh1, h2, h3, h4, h5, h6 {\n    color: rgba(80, 55, 35, 1);\n    font-family: 'Times New Roman', serif;\n    text-shadow: 2px 2px 4px rgba(60, 40, 25, 0.5);\n    font-weight: bold;\n}\n\n/* Dark vintage form elements */\ninput, select, textarea {\n    background: rgba(180, 150, 120, 0.9);\n    border: 3px solid rgba(140, 100, 70, 0.9);\n    color: rgba(100, 70, 50, 1);\n    border-radius: 8px;\n    font-family: 'Times New Roman', serif;\n    box-shadow: inset 0 2px 4px rgba(60, 40, 25, 0.3);\n}\n\ninput:focus, select:focus, textarea:focus {\n    border-color: rgba(120, 85, 65, 1);\n    box-shadow: \n        0 0 8px rgba(120, 85, 65, 0.4),\n        inset 0 2px 4px rgba(60, 40, 25, 0.3);\n}\n\n/* Add dark vintage paper aging effect */\n.mes::after {\n    content: '';\n    position: absolute;\n    top: 0;\n    left: 0;\n    right: 0;\n    bottom: 0;\n    background: \n        radial-gradient(circle at 20% 20%, rgba(120, 90, 60, 0.1) 0%, transparent 50%),\n        radial-gradient(circle at 80% 80%, rgba(100, 70, 50, 0.1) 0%, transparent 50%);\n    pointer-events: none;\n    border-radius: 15px;\n}\n\n/* Dark vintage navigation */\n.navbar, .header {\n    background: rgba(160, 130, 100, 0.95);\n    border-bottom: 3px solid rgba(140, 100, 70, 0.9);\n    box-shadow: 0 3px 8px rgba(60, 40, 25, 0.3);\n}\n\n/* Dark vintage footer */\n.footer {\n    background: rgba(160, 130, 100, 0.95);\n    border-top: 3px solid rgba(140, 100, 70, 0.9);\n    box-shadow: 0 -3px 8px rgba(60, 40, 25, 0.3);\n}\n",
    "bogus_folders": false,
    "zoomed_avatar_magnification": false,
    "reduced_motion": false,
    "compact_input_area": false,
    "toastr_position": "toast-top-right",
    "show_swipe_num_all_messages": true,
    "click_to_edit": true,
    "notes": "Dark vintage sepia theme with rich brown tones, aged paper effects, and classic typography."
}