{
    "name": "Arcane Nebula",
    "blur_strength": 12,
    "main_text_color": "rgba(172, 220, 236, 1)",
    "italics_text_color": "rgba(215, 156, 226, 1)",
    "underline_text_color": "rgba(226, 205, 141, 1)",
    "quote_text_color": "rgba(139, 133, 214, 1)",
    "blur_tint_color": "rgba(6, 66, 86, 0.8)",
    "chat_tint_color": "rgba(80, 8, 94, 0.7)",
    "user_mes_blur_tint_color": "rgba(107, 81, 6, 0.68)",
    "bot_mes_blur_tint_color": "rgba(16, 7, 115, 0.7)",
    "shadow_color": "rgba(23, 130, 68, 0.82)",
    "shadow_width": 3,
    "border_color": "rgba(134, 16, 158, 0.88)",
    "font_scale": 1.08,
    "fast_ui_mode": true,
    "waifuMode": false,
    "avatar_style": 3,
    "chat_display": 0,
    "noShadows": false,
    "chat_width": 57,
    "timer_enabled": true,
    "timestamps_enabled": true,
    "timestamp_model_icon": false,
    "mesIDDisplay_enabled": false,
    "hideChatAvatars_enabled": true,
    "message_token_count_enabled": false,
    "expand_message_actions": true,
    "enableZenSliders": false,
    "enableLabMode": false,
    "hotswap_enabled": true,
    "custom_css": "/* Arcane Nebula signature weave */\nbody {\n    color: rgba(172, 220, 236, 1);\n    background-color: rgba(80, 8, 94, 0.7);\n    background-attachment: fixed;\n    overflow-x: hidden;\n}\n\nbody::before,\nbody::after {\n    content: '';\n    position: fixed;\n    inset: 0;\n    pointer-events: none;\n}\n\nbody {\n    background-image:\n        radial-gradient(circle at 4% 0%, rgba(139, 133, 214, 1) 0%, transparent 58%),\n        radial-gradient(circle at 52% 15%, rgba(215, 156, 226, 1) 0%, transparent 64%),\n        conic-gradient(from 316deg, rgba(172, 220, 236, 1), rgba(226, 205, 141, 1), rgba(215, 156, 226, 1), rgba(139, 133, 214, 1), rgba(172, 220, 236, 1));\n    animation: arcane-nebula-bg 11.22s ease-in-out infinite alternate;\n    backdrop-filter: saturate(145%) hue-rotate(50deg);\n}\n\nbody::before {\n    inset: -12vh;\n    background: radial-gradient(circle, rgba(194, 214, 198, 1.00) 0%, transparent 64%);\n    filter: blur(48px);\n    mix-blend-mode: screen;\n    animation: arcane-nebula-orb 10.55s ease-in-out infinite alternate;\n    opacity: 0.32;\n}\n\nbody::after {\n    background: linear-gradient(115deg, transparent 0 28%, rgba(185, 147, 221, 1.00) 48%, transparent 72%);\n    mix-blend-mode: color-dodge;\n    animation: arcane-nebula-scan 11.50s linear infinite;\n    opacity: 0.22;\n}\n\n.mes, .mesText, .swipe-message {\n    background: linear-gradient(135deg, rgba(107, 81, 6, 0.68), rgba(16, 7, 115, 0.7));\n    border: 1px solid rgba(134, 16, 158, 0.88);\n    box-shadow: 0 0 34px rgba(215, 156, 226, 1);\n    backdrop-filter: blur(8.0px) saturate(180%);\n    transform-style: preserve-3d;\n    transition: transform 0.6s ease, box-shadow 0.6s ease;\n}\n\n.mes:hover {\n    transform: translateY(-6px) rotateX(-2.43deg) rotateY(2.79deg) scale(1.02);\n    box-shadow: 0 18px 48px rgba(139, 133, 214, 1);\n}\n\n.chat_mes_block .mes_text p code {\n    background: rgba(0, 0, 0, 0.45);\n    color: rgba(139, 133, 214, 1);\n    border-radius: 8px;\n    padding: 2px 6px;\n    box-shadow: 0 0 18px rgba(215, 156, 226, 1);\n}\n\n.chat_mes_block .mes_text blockquote {\n    border-left: 3px solid rgba(139, 133, 214, 1);\n    background: rgba(0, 0, 0, 0.32);\n    box-shadow: inset 0 0 18px rgba(215, 156, 226, 1);\n}\n\n.mes .avatar {\n    filter: drop-shadow(0 0 12px rgba(215, 156, 226, 1));\n}\n\n::selection {\n    background: rgba(139, 133, 214, 1);\n    color: rgba(172, 220, 236, 1);\n}\n\n@keyframes arcane-nebula-bg {\n    0% { transform: scale(1) translate3d(0, 0, 0); }\n    50% { transform: scale(1.06) translate3d(-0.30%, -0.56%, 0); }\n    100% { transform: scale(1.12) translate3d(2.82%, -2.37%, 0); }\n}\n\n@keyframes arcane-nebula-orb {\n    0% { transform: translate3d(-3%, -3%, 0) scale(1); opacity: 0.18; }\n    50% { transform: translate3d(4%, 5%, 0) scale(1.08); opacity: 0.36; }\n    100% { transform: translate3d(-2%, 6%, 0) scale(1.02); opacity: 0.24; }\n}\n\n@keyframes arcane-nebula-scan {\n    0% { transform: rotate(0deg); opacity: 0.12; }\n    50% { opacity: 0.28; }\n    100% { transform: rotate(360deg); opacity: 0.12; }\n}\n\n@keyframes arcane-nebula-mesh {\n    0% { transform: translateY(-4%) scale(1); opacity: 0.2; }\n    50% { transform: translateY(4%) scale(1.06); opacity: 0.32; }\n    100% { transform: translateY(-6%) scale(1.02); opacity: 0.24; }\n}",
    "bogus_folders": false,
    "zoomed_avatar_magnification": false,
    "reduced_motion": false,
    "compact_input_area": true,
    "toastr_position": "toast-bottom-right",
    "show_swipe_num_all_messages": false,
    "click_to_edit": true,
    "notes": "Generatively enhanced CSS from update_theme_css.py"
}
