{
    "name": "Azure Overdrive",
    "blur_strength": 16,
    "main_text_color": "rgba(174, 172, 236, 1)",
    "italics_text_color": "rgba(226, 156, 183, 1)",
    "underline_text_color": "rgba(181, 226, 141, 1)",
    "quote_text_color": "rgba(203, 133, 214, 1)",
    "blur_tint_color": "rgba(8, 6, 86, 0.8)",
    "chat_tint_color": "rgba(94, 8, 41, 0.7)",
    "user_mes_blur_tint_color": "rgba(53, 107, 6, 0.68)",
    "bot_mes_blur_tint_color": "rgba(101, 7, 115, 0.7)",
    "shadow_color": "rgba(23, 109, 130, 0.82)",
    "shadow_width": 3,
    "border_color": "rgba(158, 16, 70, 0.88)",
    "font_scale": 0.97,
    "fast_ui_mode": false,
    "waifuMode": false,
    "avatar_style": 2,
    "chat_display": 2,
    "noShadows": false,
    "chat_width": 64,
    "timer_enabled": true,
    "timestamps_enabled": true,
    "timestamp_model_icon": false,
    "mesIDDisplay_enabled": true,
    "hideChatAvatars_enabled": false,
    "message_token_count_enabled": true,
    "expand_message_actions": false,
    "enableZenSliders": false,
    "enableLabMode": true,
    "hotswap_enabled": false,
    "custom_css": "/* Azure Overdrive signature weave */\nbody {\n    color: rgba(174, 172, 236, 1);\n    background-color: rgba(94, 8, 41, 0.7);\n    background-attachment: fixed;\n    overflow-x: hidden;\n}\n\nbody::before,\nbody::after {\n    content: '';\n    position: fixed;\n    inset: 0;\n    pointer-events: none;\n}\n\nbody {\n    background-image:\n        radial-gradient(circle at 67% 75%, rgba(181, 226, 141, 1) 0%, transparent 58%),\n        radial-gradient(circle at 59% 7%, rgba(226, 156, 183, 1) 0%, transparent 64%),\n        conic-gradient(from 274deg, rgba(174, 172, 236, 1), rgba(181, 226, 141, 1), rgba(226, 156, 183, 1), rgba(203, 133, 214, 1), rgba(174, 172, 236, 1));\n    animation: azure-overdrive-bg 10.19s ease-in-out infinite alternate;\n    backdrop-filter: saturate(145%) hue-rotate(-51deg);\n}\n\nbody::before {\n    inset: -12vh;\n    background: radial-gradient(circle, rgba(177, 194, 198, 1.00) 0%, transparent 64%);\n    filter: blur(48px);\n    mix-blend-mode: screen;\n    animation: azure-overdrive-orb 24.18s ease-in-out infinite alternate;\n    opacity: 0.32;\n}\n\nbody::after {\n    background: linear-gradient(302deg, transparent 0 28%, rgba(217, 147, 195, 1.00) 48%, transparent 72%);\n    mix-blend-mode: color-dodge;\n    animation: azure-overdrive-scan 9.85s linear infinite;\n    opacity: 0.22;\n}\n\n.mes, .mesText, .swipe-message {\n    background: linear-gradient(135deg, rgba(53, 107, 6, 0.68), rgba(101, 7, 115, 0.7));\n    border: 1px solid rgba(158, 16, 70, 0.88);\n    box-shadow: 0 0 34px rgba(226, 156, 183, 1);\n    backdrop-filter: blur(11.9px) saturate(180%);\n    transform-style: preserve-3d;\n    transition: transform 0.6s ease, box-shadow 0.6s ease;\n}\n\n.mes:hover {\n    transform: translateY(-6px) rotateX(-1.43deg) rotateY(-1.86deg) scale(1.02);\n    box-shadow: 0 18px 48px rgba(181, 226, 141, 1);\n}\n\n.chat_mes_block .mes_text p code {\n    background: rgba(0, 0, 0, 0.45);\n    color: rgba(181, 226, 141, 1);\n    border-radius: 8px;\n    padding: 2px 6px;\n    box-shadow: 0 0 18px rgba(226, 156, 183, 1);\n}\n\n.chat_mes_block .mes_text blockquote {\n    border-left: 3px solid rgba(181, 226, 141, 1);\n    background: rgba(0, 0, 0, 0.32);\n    box-shadow: inset 0 0 18px rgba(226, 156, 183, 1);\n}\n\n.mes .avatar {\n    filter: drop-shadow(0 0 12px rgba(226, 156, 183, 1));\n}\n\n::selection {\n    background: rgba(181, 226, 141, 1);\n    color: rgba(174, 172, 236, 1);\n}\n\n@keyframes azure-overdrive-bg {\n    0% { transform: scale(1) translate3d(0, 0, 0); }\n    50% { transform: scale(1.06) translate3d(1.74%, 2.60%, 0); }\n    100% { transform: scale(1.12) translate3d(-1.59%, 4.03%, 0); }\n}\n\n@keyframes azure-overdrive-orb {\n    0% { transform: translate3d(-3%, -3%, 0) scale(1); opacity: 0.18; }\n    50% { transform: translate3d(4%, 5%, 0) scale(1.08); opacity: 0.36; }\n    100% { transform: translate3d(-2%, 6%, 0) scale(1.02); opacity: 0.24; }\n}\n\n@keyframes azure-overdrive-scan {\n    0% { transform: rotate(0deg); opacity: 0.12; }\n    50% { opacity: 0.28; }\n    100% { transform: rotate(360deg); opacity: 0.12; }\n}\n\n@keyframes azure-overdrive-mesh {\n    0% { transform: translateY(-4%) scale(1); opacity: 0.2; }\n    50% { transform: translateY(4%) scale(1.06); opacity: 0.32; }\n    100% { transform: translateY(-6%) scale(1.02); opacity: 0.24; }\n}",
    "bogus_folders": true,
    "zoomed_avatar_magnification": true,
    "reduced_motion": true,
    "compact_input_area": true,
    "toastr_position": "toast-bottom-right",
    "show_swipe_num_all_messages": false,
    "click_to_edit": false,
    "notes": "Generatively enhanced CSS from update_theme_css.py"
}
