{
    "name": "Blossom Rift",
    "blur_strength": 9,
    "main_text_color": "rgba(236, 197, 172, 1)",
    "italics_text_color": "rgba(159, 226, 156, 1)",
    "underline_text_color": "rgba(141, 151, 226, 1)",
    "quote_text_color": "rgba(197, 214, 133, 1)",
    "blur_tint_color": "rgba(86, 36, 6, 0.8)",
    "chat_tint_color": "rgba(11, 94, 8, 0.7)",
    "user_mes_blur_tint_color": "rgba(6, 17, 107, 0.68)",
    "bot_mes_blur_tint_color": "rgba(92, 115, 7, 0.7)",
    "shadow_color": "rgba(130, 23, 71, 0.82)",
    "shadow_width": 3,
    "border_color": "rgba(20, 158, 16, 0.88)",
    "font_scale": 1.11,
    "fast_ui_mode": true,
    "waifuMode": false,
    "avatar_style": 0,
    "chat_display": 0,
    "noShadows": false,
    "chat_width": 61,
    "timer_enabled": false,
    "timestamps_enabled": true,
    "timestamp_model_icon": true,
    "mesIDDisplay_enabled": false,
    "hideChatAvatars_enabled": true,
    "message_token_count_enabled": false,
    "expand_message_actions": true,
    "enableZenSliders": true,
    "enableLabMode": false,
    "hotswap_enabled": true,
    "custom_css": "/* Blossom Rift signature weave */\nbody {\n    color: rgba(236, 197, 172, 1);\n    background-color: rgba(11, 94, 8, 0.7);\n    background-attachment: fixed;\n    overflow-x: hidden;\n}\n\nbody::before,\nbody::after {\n    content: '';\n    position: fixed;\n    inset: 0;\n    pointer-events: none;\n}\n\nbody {\n    background-image:\n        linear-gradient(212deg, rgba(159, 226, 156, 1), transparent 45%),\n        repeating-radial-gradient(circle, transparent 0 12px, rgba(198, 179, 194, 1.00) 12px 18px),\n        linear-gradient(323deg, rgba(141, 151, 226, 1), rgba(197, 214, 133, 1), rgba(197, 214, 133, 1));\n    animation: blossom-rift-bg 16.49s alternate infinite;\n    background-size: cover, 280px 280px, cover;\n    filter: saturate(170%) brightness(95%);\n}\n\nbody::before {\n    background: repeating-linear-gradient(187deg, transparent 0 22px, rgba(174, 221, 147, 1.00) 22px 44px);\n    mask-image: radial-gradient(circle at center, rgba(0, 0, 0, 1) 0%, transparent 68%);\n    animation: blossom-rift-mesh 13.90s alternate infinite;\n    opacity: 0.3;\n}\n\nbody::after {\n    background: radial-gradient(circle at 54% 34%, rgba(197, 214, 133, 1) 0%, transparent 68%);\n    mix-blend-mode: screen;\n    animation: blossom-rift-orb 11.18s ease-in-out infinite;\n    opacity: 0.28;\n}\n\n.mes, .mesText, .swipe-message {\n    background: linear-gradient(135deg, rgba(6, 17, 107, 0.68), rgba(92, 115, 7, 0.7));\n    border: 1px solid rgba(20, 158, 16, 0.88);\n    box-shadow: 0 0 34px rgba(197, 214, 133, 1);\n    backdrop-filter: blur(8.2px) saturate(180%);\n    transform-style: preserve-3d;\n    transition: transform 0.6s ease, box-shadow 0.6s ease;\n}\n\n.mes:hover {\n    transform: translateY(-6px) rotateX(-2.27deg) rotateY(1.72deg) scale(1.02);\n    box-shadow: 0 18px 48px rgba(141, 151, 226, 1);\n}\n\n.chat_mes_block .mes_text p code {\n    background: rgba(0, 0, 0, 0.45);\n    color: rgba(141, 151, 226, 1);\n    border-radius: 8px;\n    padding: 2px 6px;\n    box-shadow: 0 0 18px rgba(197, 214, 133, 1);\n}\n\n.chat_mes_block .mes_text blockquote {\n    border-left: 3px solid rgba(141, 151, 226, 1);\n    background: rgba(0, 0, 0, 0.32);\n    box-shadow: inset 0 0 18px rgba(197, 214, 133, 1);\n}\n\n.mes .avatar {\n    filter: drop-shadow(0 0 12px rgba(197, 214, 133, 1));\n}\n\n::selection {\n    background: rgba(141, 151, 226, 1);\n    color: rgba(236, 197, 172, 1);\n}\n\n@keyframes blossom-rift-bg {\n    0% { transform: scale(1) translate3d(0, 0, 0); }\n    50% { transform: scale(1.06) translate3d(2.52%, -1.94%, 0); }\n    100% { transform: scale(1.12) translate3d(2.40%, -1.89%, 0); }\n}\n\n@keyframes blossom-rift-orb {\n    0% { transform: translate3d(-3%, -3%, 0) scale(1); opacity: 0.18; }\n    50% { transform: translate3d(4%, 5%, 0) scale(1.08); opacity: 0.36; }\n    100% { transform: translate3d(-2%, 6%, 0) scale(1.02); opacity: 0.24; }\n}\n\n@keyframes blossom-rift-scan {\n    0% { transform: rotate(0deg); opacity: 0.12; }\n    50% { opacity: 0.28; }\n    100% { transform: rotate(360deg); opacity: 0.12; }\n}\n\n@keyframes blossom-rift-mesh {\n    0% { transform: translateY(-4%) scale(1); opacity: 0.2; }\n    50% { transform: translateY(4%) scale(1.06); opacity: 0.32; }\n    100% { transform: translateY(-6%) scale(1.02); opacity: 0.24; }\n}",
    "bogus_folders": false,
    "zoomed_avatar_magnification": true,
    "reduced_motion": false,
    "compact_input_area": false,
    "toastr_position": "toast-top-left",
    "show_swipe_num_all_messages": false,
    "click_to_edit": false,
    "notes": "Generatively enhanced CSS from update_theme_css.py"
}
