{
    "name": "Celestial Matrix",
    "blur_strength": 10,
    "main_text_color": "rgba(236, 236, 172, 1)",
    "italics_text_color": "rgba(156, 226, 197, 1)",
    "underline_text_color": "rgba(184, 141, 226, 1)",
    "quote_text_color": "rgba(146, 214, 133, 1)",
    "blur_tint_color": "rgba(86, 86, 6, 0.8)",
    "chat_tint_color": "rgba(8, 94, 58, 0.7)",
    "user_mes_blur_tint_color": "rgba(56, 6, 107, 0.68)",
    "bot_mes_blur_tint_color": "rgba(25, 115, 7, 0.7)",
    "shadow_color": "rgba(130, 41, 23, 0.82)",
    "shadow_width": 4,
    "border_color": "rgba(16, 158, 99, 0.88)",
    "font_scale": 1.05,
    "fast_ui_mode": false,
    "waifuMode": true,
    "avatar_style": 3,
    "chat_display": 1,
    "noShadows": true,
    "chat_width": 48,
    "timer_enabled": false,
    "timestamps_enabled": true,
    "timestamp_model_icon": false,
    "mesIDDisplay_enabled": false,
    "hideChatAvatars_enabled": true,
    "message_token_count_enabled": true,
    "expand_message_actions": true,
    "enableZenSliders": false,
    "enableLabMode": false,
    "hotswap_enabled": false,
    "custom_css": "/* Celestial Matrix signature weave */\nbody {\n    color: rgba(236, 236, 172, 1);\n    background-color: rgba(8, 94, 58, 0.7);\n    background-attachment: fixed;\n    overflow-x: hidden;\n}\n\nbody::before,\nbody::after {\n    content: '';\n    position: fixed;\n    inset: 0;\n    pointer-events: none;\n}\n\nbody {\n    background-image:\n        radial-gradient(circle at 75% 78%, rgba(184, 141, 226, 1) 0%, transparent 58%),\n        radial-gradient(circle at 40% 29%, rgba(156, 226, 197, 1) 0%, transparent 64%),\n        conic-gradient(from 229deg, rgba(236, 236, 172, 1), rgba(184, 141, 226, 1), rgba(156, 226, 197, 1), rgba(146, 214, 133, 1), rgba(236, 236, 172, 1));\n    animation: celestial-matrix-bg 11.40s ease-in-out infinite alternate;\n    backdrop-filter: saturate(145%) hue-rotate(-129deg);\n}\n\nbody::before {\n    inset: -12vh;\n    background: radial-gradient(circle, rgba(215, 198, 194, 1.00) 0%, transparent 64%);\n    filter: blur(48px);\n    mix-blend-mode: screen;\n    animation: celestial-matrix-orb 11.97s ease-in-out infinite alternate;\n    opacity: 0.32;\n}\n\nbody::after {\n    background: linear-gradient(68deg, transparent 0 28%, rgba(152, 221, 171, 1.00) 48%, transparent 72%);\n    mix-blend-mode: color-dodge;\n    animation: celestial-matrix-scan 11.88s linear infinite;\n    opacity: 0.22;\n}\n\n.mes, .mesText, .swipe-message {\n    background: linear-gradient(135deg, rgba(56, 6, 107, 0.68), rgba(25, 115, 7, 0.7));\n    border: 1px solid rgba(16, 158, 99, 0.88);\n    box-shadow: 0 0 34px rgba(156, 226, 197, 1);\n    backdrop-filter: blur(4.5px) saturate(180%);\n    transform-style: preserve-3d;\n    transition: transform 0.6s ease, box-shadow 0.6s ease;\n}\n\n.mes:hover {\n    transform: translateY(-6px) rotateX(1.42deg) rotateY(0.40deg) scale(1.02);\n    box-shadow: 0 18px 48px rgba(184, 141, 226, 1);\n}\n\n.chat_mes_block .mes_text p code {\n    background: rgba(0, 0, 0, 0.45);\n    color: rgba(184, 141, 226, 1);\n    border-radius: 8px;\n    padding: 2px 6px;\n    box-shadow: 0 0 18px rgba(156, 226, 197, 1);\n}\n\n.chat_mes_block .mes_text blockquote {\n    border-left: 3px solid rgba(184, 141, 226, 1);\n    background: rgba(0, 0, 0, 0.32);\n    box-shadow: inset 0 0 18px rgba(156, 226, 197, 1);\n}\n\n.mes .avatar {\n    filter: drop-shadow(0 0 12px rgba(156, 226, 197, 1));\n}\n\n::selection {\n    background: rgba(184, 141, 226, 1);\n    color: rgba(236, 236, 172, 1);\n}\n\n@keyframes celestial-matrix-bg {\n    0% { transform: scale(1) translate3d(0, 0, 0); }\n    50% { transform: scale(1.06) translate3d(2.28%, 1.79%, 0); }\n    100% { transform: scale(1.12) translate3d(-3.63%, 3.92%, 0); }\n}\n\n@keyframes celestial-matrix-orb {\n    0% { transform: translate3d(-3%, -3%, 0) scale(1); opacity: 0.18; }\n    50% { transform: translate3d(4%, 5%, 0) scale(1.08); opacity: 0.36; }\n    100% { transform: translate3d(-2%, 6%, 0) scale(1.02); opacity: 0.24; }\n}\n\n@keyframes celestial-matrix-scan {\n    0% { transform: rotate(0deg); opacity: 0.12; }\n    50% { opacity: 0.28; }\n    100% { transform: rotate(360deg); opacity: 0.12; }\n}\n\n@keyframes celestial-matrix-mesh {\n    0% { transform: translateY(-4%) scale(1); opacity: 0.2; }\n    50% { transform: translateY(4%) scale(1.06); opacity: 0.32; }\n    100% { transform: translateY(-6%) scale(1.02); opacity: 0.24; }\n}",
    "bogus_folders": false,
    "zoomed_avatar_magnification": true,
    "reduced_motion": false,
    "compact_input_area": false,
    "toastr_position": "toast-top-left",
    "show_swipe_num_all_messages": false,
    "click_to_edit": false,
    "notes": "Generatively enhanced CSS from update_theme_css.py"
}
