{
    "name": "Chromatic Spark",
    "blur_strength": 12,
    "main_text_color": "rgba(200, 236, 172, 1)",
    "italics_text_color": "rgba(156, 216, 226, 1)",
    "underline_text_color": "rgba(226, 141, 221, 1)",
    "quote_text_color": "rgba(133, 214, 165, 1)",
    "blur_tint_color": "rgba(41, 86, 6, 0.8)",
    "chat_tint_color": "rgba(8, 81, 94, 0.7)",
    "user_mes_blur_tint_color": "rgba(107, 6, 100, 0.68)",
    "bot_mes_blur_tint_color": "rgba(7, 115, 50, 0.7)",
    "shadow_color": "rgba(130, 101, 23, 0.82)",
    "shadow_width": 2,
    "border_color": "rgba(16, 136, 158, 0.88)",
    "font_scale": 1.08,
    "fast_ui_mode": true,
    "waifuMode": false,
    "avatar_style": 1,
    "chat_display": 0,
    "noShadows": false,
    "chat_width": 65,
    "timer_enabled": false,
    "timestamps_enabled": false,
    "timestamp_model_icon": false,
    "mesIDDisplay_enabled": true,
    "hideChatAvatars_enabled": false,
    "message_token_count_enabled": false,
    "expand_message_actions": true,
    "enableZenSliders": false,
    "enableLabMode": false,
    "hotswap_enabled": true,
    "custom_css": "/* Chromatic Spark signature weave */\nbody {\n    color: rgba(200, 236, 172, 1);\n    background-color: rgba(8, 81, 94, 0.7);\n    background-attachment: fixed;\n    overflow-x: hidden;\n}\n\nbody::before,\nbody::after {\n    content: '';\n    position: fixed;\n    inset: 0;\n    pointer-events: none;\n}\n\nbody {\n    background-image:\n        linear-gradient(131deg, rgba(156, 216, 226, 1), transparent 45%),\n        repeating-radial-gradient(circle, transparent 0 12px, rgba(210, 198, 192, 1.00) 12px 18px),\n        linear-gradient(302deg, rgba(156, 216, 226, 1), rgba(133, 214, 165, 1), rgba(200, 236, 172, 1));\n    animation: chromatic-spark-bg 13.20s alternate infinite;\n    background-size: cover, 280px 280px, cover;\n    filter: saturate(170%) brightness(95%);\n}\n\nbody::before {\n    background: repeating-linear-gradient(61deg, transparent 0 22px, rgba(147, 215, 202, 1.00) 22px 44px);\n    mask-image: radial-gradient(circle at center, rgba(0, 0, 0, 1) 0%, transparent 68%);\n    animation: chromatic-spark-mesh 23.22s alternate infinite;\n    opacity: 0.3;\n}\n\nbody::after {\n    background: radial-gradient(circle at 79% 24%, rgba(200, 236, 172, 1) 0%, transparent 68%);\n    mix-blend-mode: screen;\n    animation: chromatic-spark-orb 18.07s ease-in-out infinite;\n    opacity: 0.28;\n}\n\n.mes, .mesText, .swipe-message {\n    background: linear-gradient(135deg, rgba(107, 6, 100, 0.68), rgba(7, 115, 50, 0.7));\n    border: 1px solid rgba(16, 136, 158, 0.88);\n    box-shadow: 0 0 34px rgba(200, 236, 172, 1);\n    backdrop-filter: blur(4.9px) saturate(180%);\n    transform-style: preserve-3d;\n    transition: transform 0.6s ease, box-shadow 0.6s ease;\n}\n\n.mes:hover {\n    transform: translateY(-6px) rotateX(1.14deg) rotateY(1.55deg) scale(1.02);\n    box-shadow: 0 18px 48px rgba(156, 216, 226, 1);\n}\n\n.chat_mes_block .mes_text p code {\n    background: rgba(0, 0, 0, 0.45);\n    color: rgba(156, 216, 226, 1);\n    border-radius: 8px;\n    padding: 2px 6px;\n    box-shadow: 0 0 18px rgba(200, 236, 172, 1);\n}\n\n.chat_mes_block .mes_text blockquote {\n    border-left: 3px solid rgba(156, 216, 226, 1);\n    background: rgba(0, 0, 0, 0.32);\n    box-shadow: inset 0 0 18px rgba(200, 236, 172, 1);\n}\n\n.mes .avatar {\n    filter: drop-shadow(0 0 12px rgba(200, 236, 172, 1));\n}\n\n::selection {\n    background: rgba(156, 216, 226, 1);\n    color: rgba(200, 236, 172, 1);\n}\n\n@keyframes chromatic-spark-bg {\n    0% { transform: scale(1) translate3d(0, 0, 0); }\n    50% { transform: scale(1.06) translate3d(-0.68%, 0.04%, 0); }\n    100% { transform: scale(1.12) translate3d(-4.23%, 2.23%, 0); }\n}\n\n@keyframes chromatic-spark-orb {\n    0% { transform: translate3d(-3%, -3%, 0) scale(1); opacity: 0.18; }\n    50% { transform: translate3d(4%, 5%, 0) scale(1.08); opacity: 0.36; }\n    100% { transform: translate3d(-2%, 6%, 0) scale(1.02); opacity: 0.24; }\n}\n\n@keyframes chromatic-spark-scan {\n    0% { transform: rotate(0deg); opacity: 0.12; }\n    50% { opacity: 0.28; }\n    100% { transform: rotate(360deg); opacity: 0.12; }\n}\n\n@keyframes chromatic-spark-mesh {\n    0% { transform: translateY(-4%) scale(1); opacity: 0.2; }\n    50% { transform: translateY(4%) scale(1.06); opacity: 0.32; }\n    100% { transform: translateY(-6%) scale(1.02); opacity: 0.24; }\n}",
    "bogus_folders": true,
    "zoomed_avatar_magnification": false,
    "reduced_motion": true,
    "compact_input_area": true,
    "toastr_position": "toast-bottom-right",
    "show_swipe_num_all_messages": false,
    "click_to_edit": false,
    "notes": "Generatively enhanced CSS from update_theme_css.py"
}
