{
    "name": "Coral Harbor",
    "blur_strength": 19,
    "main_text_color": "rgba(236, 211, 172, 1)",
    "italics_text_color": "rgba(156, 226, 170, 1)",
    "underline_text_color": "rgba(151, 141, 226, 1)",
    "quote_text_color": "rgba(177, 214, 133, 1)",
    "blur_tint_color": "rgba(86, 55, 6, 0.8)",
    "chat_tint_color": "rgba(8, 94, 25, 0.7)",
    "user_mes_blur_tint_color": "rgba(17, 6, 107, 0.68)",
    "bot_mes_blur_tint_color": "rgba(67, 115, 7, 0.7)",
    "shadow_color": "rgba(130, 23, 46, 0.82)",
    "shadow_width": 3,
    "border_color": "rgba(16, 158, 44, 0.88)",
    "font_scale": 1.12,
    "fast_ui_mode": true,
    "waifuMode": false,
    "avatar_style": 1,
    "chat_display": 2,
    "noShadows": false,
    "chat_width": 46,
    "timer_enabled": true,
    "timestamps_enabled": true,
    "timestamp_model_icon": true,
    "mesIDDisplay_enabled": false,
    "hideChatAvatars_enabled": true,
    "message_token_count_enabled": false,
    "expand_message_actions": true,
    "enableZenSliders": false,
    "enableLabMode": true,
    "hotswap_enabled": true,
    "custom_css": "/* Coral Harbor signature weave */\nbody {\n    color: rgba(236, 211, 172, 1);\n    background-color: rgba(8, 94, 25, 0.7);\n    background-attachment: fixed;\n    overflow-x: hidden;\n}\n\nbody::before,\nbody::after {\n    content: '';\n    position: fixed;\n    inset: 0;\n    pointer-events: none;\n}\n\nbody {\n    background-image:\n        linear-gradient(32deg, rgba(177, 214, 133, 1) 0%, transparent 48%),\n        conic-gradient(from 232deg at 50% 50%, rgba(156, 226, 170, 1), rgba(151, 141, 226, 1), rgba(151, 141, 226, 1), rgba(156, 226, 170, 1));\n    animation: coral-harbor-bg 24.66s ease-in-out infinite;\n    filter: hue-rotate(124deg) saturate(160%);\n}\n\nbody::before {\n    background: radial-gradient(circle at 61% 22%, rgba(202, 183, 194, 1.00) 0%, transparent 60%);\n    clip-path: polygon(0% 12%, 35% 0%, 65% 8%, 100% 0%, 100% 88%, 68% 100%, 32% 92%, 0% 100%);\n    animation: coral-harbor-mesh 12.35s ease-in-out infinite alternate;\n    mix-blend-mode: hard-light;\n    opacity: 0.38;\n}\n\nbody::after {\n    background: radial-gradient(ellipse at center, transparent 0 45%, rgba(0, 0, 0, 0.55) 70%);\n    mix-blend-mode: multiply;\n    animation: coral-harbor-scan 10.74s linear infinite;\n    opacity: 0.4;\n}\n\n.mes, .mesText, .swipe-message {\n    background: linear-gradient(135deg, rgba(17, 6, 107, 0.68), rgba(67, 115, 7, 0.7));\n    border: 1px solid rgba(16, 158, 44, 0.88);\n    box-shadow: 0 0 34px rgba(151, 141, 226, 1);\n    backdrop-filter: blur(8.8px) saturate(180%);\n    transform-style: preserve-3d;\n    transition: transform 0.6s ease, box-shadow 0.6s ease;\n}\n\n.mes:hover {\n    transform: translateY(-6px) rotateX(-1.10deg) rotateY(2.79deg) scale(1.02);\n    box-shadow: 0 18px 48px rgba(156, 226, 170, 1);\n}\n\n.chat_mes_block .mes_text p code {\n    background: rgba(0, 0, 0, 0.45);\n    color: rgba(156, 226, 170, 1);\n    border-radius: 8px;\n    padding: 2px 6px;\n    box-shadow: 0 0 18px rgba(151, 141, 226, 1);\n}\n\n.chat_mes_block .mes_text blockquote {\n    border-left: 3px solid rgba(156, 226, 170, 1);\n    background: rgba(0, 0, 0, 0.32);\n    box-shadow: inset 0 0 18px rgba(151, 141, 226, 1);\n}\n\n.mes .avatar {\n    filter: drop-shadow(0 0 12px rgba(151, 141, 226, 1));\n}\n\n::selection {\n    background: rgba(156, 226, 170, 1);\n    color: rgba(236, 211, 172, 1);\n}\n\n@keyframes coral-harbor-bg {\n    0% { transform: scale(1) translate3d(0, 0, 0); }\n    50% { transform: scale(1.06) translate3d(1.54%, 2.14%, 0); }\n    100% { transform: scale(1.12) translate3d(4.99%, -1.31%, 0); }\n}\n\n@keyframes coral-harbor-orb {\n    0% { transform: translate3d(-3%, -3%, 0) scale(1); opacity: 0.18; }\n    50% { transform: translate3d(4%, 5%, 0) scale(1.08); opacity: 0.36; }\n    100% { transform: translate3d(-2%, 6%, 0) scale(1.02); opacity: 0.24; }\n}\n\n@keyframes coral-harbor-scan {\n    0% { transform: rotate(0deg); opacity: 0.12; }\n    50% { opacity: 0.28; }\n    100% { transform: rotate(360deg); opacity: 0.12; }\n}\n\n@keyframes coral-harbor-mesh {\n    0% { transform: translateY(-4%) scale(1); opacity: 0.2; }\n    50% { transform: translateY(4%) scale(1.06); opacity: 0.32; }\n    100% { transform: translateY(-6%) scale(1.02); opacity: 0.24; }\n}",
    "bogus_folders": false,
    "zoomed_avatar_magnification": false,
    "reduced_motion": true,
    "compact_input_area": true,
    "toastr_position": "toast-bottom-left",
    "show_swipe_num_all_messages": false,
    "click_to_edit": false,
    "notes": "Generatively enhanced CSS from update_theme_css.py"
}
