{
    "name": "Crimson Pulsewave",
    "blur_strength": 15,
    "main_text_color": "rgba(172, 174, 236, 1)",
    "italics_text_color": "rgba(226, 156, 188, 1)",
    "underline_text_color": "rgba(186, 226, 141, 1)",
    "quote_text_color": "rgba(198, 133, 214, 1)",
    "blur_tint_color": "rgba(6, 8, 86, 0.8)",
    "chat_tint_color": "rgba(94, 8, 47, 0.7)",
    "user_mes_blur_tint_color": "rgba(59, 107, 6, 0.68)",
    "bot_mes_blur_tint_color": "rgba(94, 7, 115, 0.7)",
    "shadow_color": "rgba(23, 116, 130, 0.82)",
    "shadow_width": 2,
    "border_color": "rgba(158, 16, 80, 0.88)",
    "font_scale": 1.15,
    "fast_ui_mode": false,
    "waifuMode": true,
    "avatar_style": 2,
    "chat_display": 1,
    "noShadows": false,
    "chat_width": 51,
    "timer_enabled": true,
    "timestamps_enabled": false,
    "timestamp_model_icon": false,
    "mesIDDisplay_enabled": true,
    "hideChatAvatars_enabled": false,
    "message_token_count_enabled": true,
    "expand_message_actions": true,
    "enableZenSliders": false,
    "enableLabMode": false,
    "hotswap_enabled": true,
    "custom_css": "/* Crimson Pulsewave signature weave */\nbody {\n    color: rgba(172, 174, 236, 1);\n    background-color: rgba(94, 8, 47, 0.7);\n    background-attachment: fixed;\n    overflow-x: hidden;\n}\n\nbody::before,\nbody::after {\n    content: '';\n    position: fixed;\n    inset: 0;\n    pointer-events: none;\n}\n\nbody {\n    background-image:\n        repeating-linear-gradient(276deg, transparent 0 40px, rgba(178, 195, 198, 1.00) 40px 80px),\n        radial-gradient(circle at 19% 22%, rgba(186, 226, 141, 1) 0%, transparent 55%),\n        linear-gradient(160deg, rgba(198, 133, 214, 1), rgba(226, 156, 188, 1));\n    animation: crimson-pulsewave-bg 21.99s ease-in-out infinite alternate;\n    background-size: 120% 120%, cover, cover;\n    filter: contrast(110%) saturate(130%);\n}\n\nbody::before {\n    background: conic-gradient(from 274deg, transparent 0 25%, rgba(172, 174, 236, 1) 45%, transparent 75%);\n    animation: crimson-pulsewave-mesh 27.01s linear infinite;\n    mix-blend-mode: lighten;\n    opacity: 0.25;\n}\n\nbody::after {\n    background: radial-gradient(ellipse at center, transparent 0 40%, rgba(0, 0, 0, 0.4) 70%, transparent 100%);\n    backdrop-filter: blur(6px) saturate(180%);\n    mix-blend-mode: soft-light;\n    animation: crimson-pulsewave-scan 13.92s linear infinite;\n    opacity: 0.35;\n}\n\n.mes, .mesText, .swipe-message {\n    background: linear-gradient(135deg, rgba(59, 107, 6, 0.68), rgba(94, 7, 115, 0.7));\n    border: 1px solid rgba(158, 16, 80, 0.88);\n    box-shadow: 0 0 34px rgba(172, 174, 236, 1);\n    backdrop-filter: blur(11.5px) saturate(180%);\n    transform-style: preserve-3d;\n    transition: transform 0.6s ease, box-shadow 0.6s ease;\n}\n\n.mes:hover {\n    transform: translateY(-6px) rotateX(-0.70deg) rotateY(2.08deg) scale(1.02);\n    box-shadow: 0 18px 48px rgba(186, 226, 141, 1);\n}\n\n.chat_mes_block .mes_text p code {\n    background: rgba(0, 0, 0, 0.45);\n    color: rgba(186, 226, 141, 1);\n    border-radius: 8px;\n    padding: 2px 6px;\n    box-shadow: 0 0 18px rgba(172, 174, 236, 1);\n}\n\n.chat_mes_block .mes_text blockquote {\n    border-left: 3px solid rgba(186, 226, 141, 1);\n    background: rgba(0, 0, 0, 0.32);\n    box-shadow: inset 0 0 18px rgba(172, 174, 236, 1);\n}\n\n.mes .avatar {\n    filter: drop-shadow(0 0 12px rgba(172, 174, 236, 1));\n}\n\n::selection {\n    background: rgba(186, 226, 141, 1);\n    color: rgba(172, 174, 236, 1);\n}\n\n@keyframes crimson-pulsewave-bg {\n    0% { transform: scale(1) translate3d(0, 0, 0); }\n    50% { transform: scale(1.06) translate3d(-2.40%, 2.58%, 0); }\n    100% { transform: scale(1.12) translate3d(0.07%, 3.48%, 0); }\n}\n\n@keyframes crimson-pulsewave-orb {\n    0% { transform: translate3d(-3%, -3%, 0) scale(1); opacity: 0.18; }\n    50% { transform: translate3d(4%, 5%, 0) scale(1.08); opacity: 0.36; }\n    100% { transform: translate3d(-2%, 6%, 0) scale(1.02); opacity: 0.24; }\n}\n\n@keyframes crimson-pulsewave-scan {\n    0% { transform: rotate(0deg); opacity: 0.12; }\n    50% { opacity: 0.28; }\n    100% { transform: rotate(360deg); opacity: 0.12; }\n}\n\n@keyframes crimson-pulsewave-mesh {\n    0% { transform: translateY(-4%) scale(1); opacity: 0.2; }\n    50% { transform: translateY(4%) scale(1.06); opacity: 0.32; }\n    100% { transform: translateY(-6%) scale(1.02); opacity: 0.24; }\n}",
    "bogus_folders": true,
    "zoomed_avatar_magnification": false,
    "reduced_motion": false,
    "compact_input_area": false,
    "toastr_position": "toast-top-left",
    "show_swipe_num_all_messages": true,
    "click_to_edit": false,
    "notes": "Generatively enhanced CSS from update_theme_css.py"
}
