{
    "name": "Dreamwave Pulse",
    "blur_strength": 12,
    "main_text_color": "rgba(172, 236, 223, 1)",
    "italics_text_color": "rgba(183, 156, 226, 1)",
    "underline_text_color": "rgba(226, 166, 141, 1)",
    "quote_text_color": "rgba(133, 163, 214, 1)",
    "blur_tint_color": "rgba(6, 86, 70, 0.8)",
    "chat_tint_color": "rgba(41, 8, 94, 0.7)",
    "user_mes_blur_tint_color": "rgba(107, 36, 6, 0.68)",
    "bot_mes_blur_tint_color": "rgba(7, 47, 115, 0.7)",
    "shadow_color": "rgba(27, 130, 23, 0.82)",
    "shadow_width": 2,
    "border_color": "rgba(70, 16, 158, 0.88)",
    "font_scale": 1.0,
    "fast_ui_mode": true,
    "waifuMode": true,
    "avatar_style": 3,
    "chat_display": 0,
    "noShadows": false,
    "chat_width": 59,
    "timer_enabled": false,
    "timestamps_enabled": true,
    "timestamp_model_icon": false,
    "mesIDDisplay_enabled": false,
    "hideChatAvatars_enabled": true,
    "message_token_count_enabled": false,
    "expand_message_actions": false,
    "enableZenSliders": false,
    "enableLabMode": true,
    "hotswap_enabled": true,
    "custom_css": "/* Dreamwave Pulse signature weave */\nbody {\n    color: rgba(172, 236, 223, 1);\n    background-color: rgba(41, 8, 94, 0.7);\n    background-attachment: fixed;\n    overflow-x: hidden;\n}\n\nbody::before,\nbody::after {\n    content: '';\n    position: fixed;\n    inset: 0;\n    pointer-events: none;\n}\n\nbody {\n    background-image:\n        linear-gradient(123deg, rgba(133, 163, 214, 1) 0%, transparent 48%),\n        conic-gradient(from 214deg at 50% 50%, rgba(183, 156, 226, 1), rgba(226, 166, 141, 1), rgba(226, 166, 141, 1), rgba(183, 156, 226, 1));\n    animation: dreamwave-pulse-bg 14.20s ease-in-out infinite;\n    filter: hue-rotate(-23deg) saturate(160%);\n}\n\nbody::before {\n    background: radial-gradient(circle at 26% 26%, rgba(194, 208, 190, 1.00) 0%, transparent 60%);\n    clip-path: polygon(0% 12%, 35% 0%, 65% 8%, 100% 0%, 100% 88%, 68% 100%, 32% 92%, 0% 100%);\n    animation: dreamwave-pulse-mesh 18.32s ease-in-out infinite alternate;\n    mix-blend-mode: hard-light;\n    opacity: 0.38;\n}\n\nbody::after {\n    background: radial-gradient(ellipse at center, transparent 0 45%, rgba(0, 0, 0, 0.55) 70%);\n    mix-blend-mode: multiply;\n    animation: dreamwave-pulse-scan 15.85s linear infinite;\n    opacity: 0.4;\n}\n\n.mes, .mesText, .swipe-message {\n    background: linear-gradient(135deg, rgba(107, 36, 6, 0.68), rgba(7, 47, 115, 0.7));\n    border: 1px solid rgba(70, 16, 158, 0.88);\n    box-shadow: 0 0 34px rgba(226, 166, 141, 1);\n    backdrop-filter: blur(8.0px) saturate(180%);\n    transform-style: preserve-3d;\n    transition: transform 0.6s ease, box-shadow 0.6s ease;\n}\n\n.mes:hover {\n    transform: translateY(-6px) rotateX(-1.91deg) rotateY(0.77deg) scale(1.02);\n    box-shadow: 0 18px 48px rgba(183, 156, 226, 1);\n}\n\n.chat_mes_block .mes_text p code {\n    background: rgba(0, 0, 0, 0.45);\n    color: rgba(183, 156, 226, 1);\n    border-radius: 8px;\n    padding: 2px 6px;\n    box-shadow: 0 0 18px rgba(226, 166, 141, 1);\n}\n\n.chat_mes_block .mes_text blockquote {\n    border-left: 3px solid rgba(183, 156, 226, 1);\n    background: rgba(0, 0, 0, 0.32);\n    box-shadow: inset 0 0 18px rgba(226, 166, 141, 1);\n}\n\n.mes .avatar {\n    filter: drop-shadow(0 0 12px rgba(226, 166, 141, 1));\n}\n\n::selection {\n    background: rgba(183, 156, 226, 1);\n    color: rgba(172, 236, 223, 1);\n}\n\n@keyframes dreamwave-pulse-bg {\n    0% { transform: scale(1) translate3d(0, 0, 0); }\n    50% { transform: scale(1.06) translate3d(1.06%, -1.63%, 0); }\n    100% { transform: scale(1.12) translate3d(-4.85%, -4.15%, 0); }\n}\n\n@keyframes dreamwave-pulse-orb {\n    0% { transform: translate3d(-3%, -3%, 0) scale(1); opacity: 0.18; }\n    50% { transform: translate3d(4%, 5%, 0) scale(1.08); opacity: 0.36; }\n    100% { transform: translate3d(-2%, 6%, 0) scale(1.02); opacity: 0.24; }\n}\n\n@keyframes dreamwave-pulse-scan {\n    0% { transform: rotate(0deg); opacity: 0.12; }\n    50% { opacity: 0.28; }\n    100% { transform: rotate(360deg); opacity: 0.12; }\n}\n\n@keyframes dreamwave-pulse-mesh {\n    0% { transform: translateY(-4%) scale(1); opacity: 0.2; }\n    50% { transform: translateY(4%) scale(1.06); opacity: 0.32; }\n    100% { transform: translateY(-6%) scale(1.02); opacity: 0.24; }\n}",
    "bogus_folders": true,
    "zoomed_avatar_magnification": false,
    "reduced_motion": false,
    "compact_input_area": true,
    "toastr_position": "toast-top-right",
    "show_swipe_num_all_messages": true,
    "click_to_edit": false,
    "notes": "Generatively enhanced CSS from update_theme_css.py"
}
