{
    "name": "Galactic Prism",
    "blur_strength": 11,
    "main_text_color": "rgba(172, 188, 236, 1)",
    "italics_text_color": "rgba(226, 156, 203, 1)",
    "underline_text_color": "rgba(205, 226, 141, 1)",
    "quote_text_color": "rgba(180, 133, 214, 1)",
    "blur_tint_color": "rgba(6, 26, 86, 0.8)",
    "chat_tint_color": "rgba(94, 8, 65, 0.7)",
    "user_mes_blur_tint_color": "rgba(81, 107, 6, 0.68)",
    "bot_mes_blur_tint_color": "rgba(70, 7, 115, 0.7)",
    "shadow_color": "rgba(23, 130, 121, 0.82)",
    "shadow_width": 6,
    "border_color": "rgba(158, 16, 110, 0.88)",
    "font_scale": 0.98,
    "fast_ui_mode": true,
    "waifuMode": true,
    "avatar_style": 0,
    "chat_display": 2,
    "noShadows": false,
    "chat_width": 54,
    "timer_enabled": true,
    "timestamps_enabled": false,
    "timestamp_model_icon": true,
    "mesIDDisplay_enabled": true,
    "hideChatAvatars_enabled": false,
    "message_token_count_enabled": false,
    "expand_message_actions": false,
    "enableZenSliders": true,
    "enableLabMode": true,
    "hotswap_enabled": true,
    "custom_css": "/* Galactic Prism signature weave */\nbody {\n    color: rgba(172, 188, 236, 1);\n    background-color: rgba(94, 8, 65, 0.7);\n    background-attachment: fixed;\n    overflow-x: hidden;\n}\n\nbody::before,\nbody::after {\n    content: '';\n    position: fixed;\n    inset: 0;\n    pointer-events: none;\n}\n\nbody {\n    background-image:\n        linear-gradient(303deg, rgba(226, 156, 203, 1), transparent 45%),\n        repeating-radial-gradient(circle, transparent 0 12px, rgba(185, 203, 198, 1.00) 12px 18px),\n        linear-gradient(15deg, rgba(226, 156, 203, 1), rgba(180, 133, 214, 1), rgba(205, 226, 141, 1));\n    animation: galactic-prism-bg 23.22s alternate infinite;\n    background-size: cover, 280px 280px, cover;\n    filter: saturate(170%) brightness(95%);\n}\n\nbody::before {\n    background: repeating-linear-gradient(23deg, transparent 0 22px, rgba(208, 147, 207, 1.00) 22px 44px);\n    mask-image: radial-gradient(circle at center, rgba(0, 0, 0, 1) 0%, transparent 68%);\n    animation: galactic-prism-mesh 17.14s alternate infinite;\n    opacity: 0.3;\n}\n\nbody::after {\n    background: radial-gradient(circle at 75% 37%, rgba(205, 226, 141, 1) 0%, transparent 68%);\n    mix-blend-mode: screen;\n    animation: galactic-prism-orb 9.29s ease-in-out infinite;\n    opacity: 0.28;\n}\n\n.mes, .mesText, .swipe-message {\n    background: linear-gradient(135deg, rgba(81, 107, 6, 0.68), rgba(70, 7, 115, 0.7));\n    border: 1px solid rgba(158, 16, 110, 0.88);\n    box-shadow: 0 0 34px rgba(205, 226, 141, 1);\n    backdrop-filter: blur(10.1px) saturate(180%);\n    transform-style: preserve-3d;\n    transition: transform 0.6s ease, box-shadow 0.6s ease;\n}\n\n.mes:hover {\n    transform: translateY(-6px) rotateX(-0.68deg) rotateY(1.08deg) scale(1.02);\n    box-shadow: 0 18px 48px rgba(226, 156, 203, 1);\n}\n\n.chat_mes_block .mes_text p code {\n    background: rgba(0, 0, 0, 0.45);\n    color: rgba(226, 156, 203, 1);\n    border-radius: 8px;\n    padding: 2px 6px;\n    box-shadow: 0 0 18px rgba(205, 226, 141, 1);\n}\n\n.chat_mes_block .mes_text blockquote {\n    border-left: 3px solid rgba(226, 156, 203, 1);\n    background: rgba(0, 0, 0, 0.32);\n    box-shadow: inset 0 0 18px rgba(205, 226, 141, 1);\n}\n\n.mes .avatar {\n    filter: drop-shadow(0 0 12px rgba(205, 226, 141, 1));\n}\n\n::selection {\n    background: rgba(226, 156, 203, 1);\n    color: rgba(172, 188, 236, 1);\n}\n\n@keyframes galactic-prism-bg {\n    0% { transform: scale(1) translate3d(0, 0, 0); }\n    50% { transform: scale(1.06) translate3d(1.09%, -2.66%, 0); }\n    100% { transform: scale(1.12) translate3d(1.76%, 4.80%, 0); }\n}\n\n@keyframes galactic-prism-orb {\n    0% { transform: translate3d(-3%, -3%, 0) scale(1); opacity: 0.18; }\n    50% { transform: translate3d(4%, 5%, 0) scale(1.08); opacity: 0.36; }\n    100% { transform: translate3d(-2%, 6%, 0) scale(1.02); opacity: 0.24; }\n}\n\n@keyframes galactic-prism-scan {\n    0% { transform: rotate(0deg); opacity: 0.12; }\n    50% { opacity: 0.28; }\n    100% { transform: rotate(360deg); opacity: 0.12; }\n}\n\n@keyframes galactic-prism-mesh {\n    0% { transform: translateY(-4%) scale(1); opacity: 0.2; }\n    50% { transform: translateY(4%) scale(1.06); opacity: 0.32; }\n    100% { transform: translateY(-6%) scale(1.02); opacity: 0.24; }\n}",
    "bogus_folders": true,
    "zoomed_avatar_magnification": false,
    "reduced_motion": false,
    "compact_input_area": true,
    "toastr_position": "toast-top-center",
    "show_swipe_num_all_messages": true,
    "click_to_edit": true,
    "notes": "Generatively enhanced CSS from update_theme_css.py"
}
