{
    "name": "Glimmer Rift",
    "blur_strength": 16,
    "main_text_color": "rgba(236, 172, 229, 1)",
    "italics_text_color": "rgba(226, 204, 156, 1)",
    "underline_text_color": "rgba(141, 226, 192, 1)",
    "quote_text_color": "rgba(214, 133, 138, 1)",
    "blur_tint_color": "rgba(86, 6, 78, 0.8)",
    "chat_tint_color": "rgba(94, 67, 8, 0.7)",
    "user_mes_blur_tint_color": "rgba(6, 107, 66, 0.68)",
    "bot_mes_blur_tint_color": "rgba(115, 7, 15, 0.7)",
    "shadow_color": "rgba(52, 23, 130, 0.82)",
    "shadow_width": 4,
    "border_color": "rgba(158, 113, 16, 0.88)",
    "font_scale": 1.15,
    "fast_ui_mode": true,
    "waifuMode": false,
    "avatar_style": 0,
    "chat_display": 0,
    "noShadows": false,
    "chat_width": 59,
    "timer_enabled": true,
    "timestamps_enabled": true,
    "timestamp_model_icon": true,
    "mesIDDisplay_enabled": true,
    "hideChatAvatars_enabled": true,
    "message_token_count_enabled": false,
    "expand_message_actions": true,
    "enableZenSliders": false,
    "enableLabMode": false,
    "hotswap_enabled": true,
    "custom_css": "/* Glimmer Rift signature weave */\nbody {\n    color: rgba(236, 172, 229, 1);\n    background-color: rgba(94, 67, 8, 0.7);\n    background-attachment: fixed;\n    overflow-x: hidden;\n}\n\nbody::before,\nbody::after {\n    content: '';\n    position: fixed;\n    inset: 0;\n    pointer-events: none;\n}\n\nbody {\n    background-image:\n        conic-gradient(from 325deg, rgba(236, 172, 229, 1), rgba(226, 204, 156, 1), rgba(141, 226, 192, 1), rgba(214, 133, 138, 1), rgba(236, 172, 229, 1)),\n        radial-gradient(circle at 65% 21%, rgba(226, 204, 156, 1) 0%, transparent 70%);\n    animation: glimmer-rift-bg 9.57s ease-in-out infinite;\n    filter: saturate(150%) brightness(105%);\n}\n\nbody::before {\n    background: repeating-conic-gradient(from 264deg, transparent 0 15deg, rgba(198, 194, 214, 1.00) 15deg 30deg);\n    animation: glimmer-rift-mesh 14.47s linear infinite;\n    mix-blend-mode: color-dodge;\n    opacity: 0.24;\n}\n\nbody::after {\n    background: radial-gradient(circle at center, transparent 0 35%, rgba(0, 0, 0, 0.55) 60%);\n    backdrop-filter: blur(8px) saturate(190%);\n    animation: glimmer-rift-scan 8.12s ease-in-out infinite;\n    opacity: 0.36;\n}\n\n.mes, .mesText, .swipe-message {\n    background: linear-gradient(135deg, rgba(6, 107, 66, 0.68), rgba(115, 7, 15, 0.7));\n    border: 1px solid rgba(158, 113, 16, 0.88);\n    box-shadow: 0 0 34px rgba(226, 204, 156, 1);\n    backdrop-filter: blur(4.9px) saturate(180%);\n    transform-style: preserve-3d;\n    transition: transform 0.6s ease, box-shadow 0.6s ease;\n}\n\n.mes:hover {\n    transform: translateY(-6px) rotateX(2.47deg) rotateY(2.05deg) scale(1.02);\n    box-shadow: 0 18px 48px rgba(226, 204, 156, 1);\n}\n\n.chat_mes_block .mes_text p code {\n    background: rgba(0, 0, 0, 0.45);\n    color: rgba(226, 204, 156, 1);\n    border-radius: 8px;\n    padding: 2px 6px;\n    box-shadow: 0 0 18px rgba(226, 204, 156, 1);\n}\n\n.chat_mes_block .mes_text blockquote {\n    border-left: 3px solid rgba(226, 204, 156, 1);\n    background: rgba(0, 0, 0, 0.32);\n    box-shadow: inset 0 0 18px rgba(226, 204, 156, 1);\n}\n\n.mes .avatar {\n    filter: drop-shadow(0 0 12px rgba(226, 204, 156, 1));\n}\n\n::selection {\n    background: rgba(226, 204, 156, 1);\n    color: rgba(236, 172, 229, 1);\n}\n\n@keyframes glimmer-rift-bg {\n    0% { transform: scale(1) translate3d(0, 0, 0); }\n    50% { transform: scale(1.06) translate3d(-2.56%, 0.31%, 0); }\n    100% { transform: scale(1.12) translate3d(-2.41%, 3.11%, 0); }\n}\n\n@keyframes glimmer-rift-orb {\n    0% { transform: translate3d(-3%, -3%, 0) scale(1); opacity: 0.18; }\n    50% { transform: translate3d(4%, 5%, 0) scale(1.08); opacity: 0.36; }\n    100% { transform: translate3d(-2%, 6%, 0) scale(1.02); opacity: 0.24; }\n}\n\n@keyframes glimmer-rift-scan {\n    0% { transform: rotate(0deg); opacity: 0.12; }\n    50% { opacity: 0.28; }\n    100% { transform: rotate(360deg); opacity: 0.12; }\n}\n\n@keyframes glimmer-rift-mesh {\n    0% { transform: translateY(-4%) scale(1); opacity: 0.2; }\n    50% { transform: translateY(4%) scale(1.06); opacity: 0.32; }\n    100% { transform: translateY(-6%) scale(1.02); opacity: 0.24; }\n}",
    "bogus_folders": false,
    "zoomed_avatar_magnification": false,
    "reduced_motion": false,
    "compact_input_area": false,
    "toastr_position": "toast-top-center",
    "show_swipe_num_all_messages": true,
    "click_to_edit": true,
    "notes": "Generatively enhanced CSS from update_theme_css.py"
}
