{
    "name": "Inferno Glow",
    "blur_strength": 14,
    "main_text_color": "rgba(236, 172, 177, 1)",
    "italics_text_color": "rgba(190, 226, 156, 1)",
    "underline_text_color": "rgba(141, 189, 226, 1)",
    "quote_text_color": "rgba(214, 195, 133, 1)",
    "blur_tint_color": "rgba(86, 6, 11, 0.8)",
    "chat_tint_color": "rgba(50, 94, 8, 0.7)",
    "user_mes_blur_tint_color": "rgba(6, 63, 107, 0.68)",
    "bot_mes_blur_tint_color": "rgba(115, 90, 7, 0.7)",
    "shadow_color": "rgba(130, 23, 119, 0.82)",
    "shadow_width": 3,
    "border_color": "rgba(84, 158, 16, 0.88)",
    "font_scale": 0.93,
    "fast_ui_mode": false,
    "waifuMode": false,
    "avatar_style": 2,
    "chat_display": 1,
    "noShadows": false,
    "chat_width": 53,
    "timer_enabled": true,
    "timestamps_enabled": true,
    "timestamp_model_icon": true,
    "mesIDDisplay_enabled": false,
    "hideChatAvatars_enabled": true,
    "message_token_count_enabled": true,
    "expand_message_actions": true,
    "enableZenSliders": true,
    "enableLabMode": true,
    "hotswap_enabled": true,
    "custom_css": "/* Inferno Glow signature weave */\nbody {\n    color: rgba(236, 172, 177, 1);\n    background-color: rgba(50, 94, 8, 0.7);\n    background-attachment: fixed;\n    overflow-x: hidden;\n}\n\nbody::before,\nbody::after {\n    content: '';\n    position: fixed;\n    inset: 0;\n    pointer-events: none;\n}\n\nbody {\n    background-image:\n        linear-gradient(235deg, rgba(190, 226, 156, 1), transparent 45%),\n        repeating-radial-gradient(circle, transparent 0 12px, rgba(198, 179, 197, 1.00) 12px 18px),\n        linear-gradient(230deg, rgba(141, 189, 226, 1), rgba(214, 195, 133, 1), rgba(214, 195, 133, 1));\n    animation: inferno-glow-bg 11.39s alternate infinite;\n    background-size: cover, 280px 280px, cover;\n    filter: saturate(170%) brightness(95%);\n}\n\nbody::before {\n    background: repeating-linear-gradient(68deg, transparent 0 22px, rgba(200, 214, 147, 1.00) 22px 44px);\n    mask-image: radial-gradient(circle at center, rgba(0, 0, 0, 1) 0%, transparent 68%);\n    animation: inferno-glow-mesh 11.68s alternate infinite;\n    opacity: 0.3;\n}\n\nbody::after {\n    background: radial-gradient(circle at 35% 18%, rgba(214, 195, 133, 1) 0%, transparent 68%);\n    mix-blend-mode: screen;\n    animation: inferno-glow-orb 17.84s ease-in-out infinite;\n    opacity: 0.28;\n}\n\n.mes, .mesText, .swipe-message {\n    background: linear-gradient(135deg, rgba(6, 63, 107, 0.68), rgba(115, 90, 7, 0.7));\n    border: 1px solid rgba(84, 158, 16, 0.88);\n    box-shadow: 0 0 34px rgba(214, 195, 133, 1);\n    backdrop-filter: blur(7.4px) saturate(180%);\n    transform-style: preserve-3d;\n    transition: transform 0.6s ease, box-shadow 0.6s ease;\n}\n\n.mes:hover {\n    transform: translateY(-6px) rotateX(-1.91deg) rotateY(1.55deg) scale(1.02);\n    box-shadow: 0 18px 48px rgba(141, 189, 226, 1);\n}\n\n.chat_mes_block .mes_text p code {\n    background: rgba(0, 0, 0, 0.45);\n    color: rgba(141, 189, 226, 1);\n    border-radius: 8px;\n    padding: 2px 6px;\n    box-shadow: 0 0 18px rgba(214, 195, 133, 1);\n}\n\n.chat_mes_block .mes_text blockquote {\n    border-left: 3px solid rgba(141, 189, 226, 1);\n    background: rgba(0, 0, 0, 0.32);\n    box-shadow: inset 0 0 18px rgba(214, 195, 133, 1);\n}\n\n.mes .avatar {\n    filter: drop-shadow(0 0 12px rgba(214, 195, 133, 1));\n}\n\n::selection {\n    background: rgba(141, 189, 226, 1);\n    color: rgba(236, 172, 177, 1);\n}\n\n@keyframes inferno-glow-bg {\n    0% { transform: scale(1) translate3d(0, 0, 0); }\n    50% { transform: scale(1.06) translate3d(-2.12%, -0.02%, 0); }\n    100% { transform: scale(1.12) translate3d(3.06%, 1.26%, 0); }\n}\n\n@keyframes inferno-glow-orb {\n    0% { transform: translate3d(-3%, -3%, 0) scale(1); opacity: 0.18; }\n    50% { transform: translate3d(4%, 5%, 0) scale(1.08); opacity: 0.36; }\n    100% { transform: translate3d(-2%, 6%, 0) scale(1.02); opacity: 0.24; }\n}\n\n@keyframes inferno-glow-scan {\n    0% { transform: rotate(0deg); opacity: 0.12; }\n    50% { opacity: 0.28; }\n    100% { transform: rotate(360deg); opacity: 0.12; }\n}\n\n@keyframes inferno-glow-mesh {\n    0% { transform: translateY(-4%) scale(1); opacity: 0.2; }\n    50% { transform: translateY(4%) scale(1.06); opacity: 0.32; }\n    100% { transform: translateY(-6%) scale(1.02); opacity: 0.24; }\n}",
    "bogus_folders": false,
    "zoomed_avatar_magnification": true,
    "reduced_motion": true,
    "compact_input_area": true,
    "toastr_position": "toast-top-center",
    "show_swipe_num_all_messages": true,
    "click_to_edit": true,
    "notes": "Generatively enhanced CSS from update_theme_css.py"
}
