{
    "name": "Iridescent Reverie",
    "blur_strength": 15,
    "main_text_color": "rgba(193, 236, 172, 1)",
    "italics_text_color": "rgba(156, 209, 226, 1)",
    "underline_text_color": "rgba(226, 141, 212, 1)",
    "quote_text_color": "rgba(133, 214, 173, 1)",
    "blur_tint_color": "rgba(32, 86, 6, 0.8)",
    "chat_tint_color": "rgba(8, 73, 94, 0.7)",
    "user_mes_blur_tint_color": "rgba(107, 6, 90, 0.68)",
    "bot_mes_blur_tint_color": "rgba(7, 115, 61, 0.7)",
    "shadow_color": "rgba(130, 112, 23, 0.82)",
    "shadow_width": 6,
    "border_color": "rgba(16, 122, 158, 0.88)",
    "font_scale": 0.9,
    "fast_ui_mode": false,
    "waifuMode": true,
    "avatar_style": 0,
    "chat_display": 1,
    "noShadows": false,
    "chat_width": 48,
    "timer_enabled": true,
    "timestamps_enabled": false,
    "timestamp_model_icon": false,
    "mesIDDisplay_enabled": true,
    "hideChatAvatars_enabled": true,
    "message_token_count_enabled": true,
    "expand_message_actions": true,
    "enableZenSliders": false,
    "enableLabMode": false,
    "hotswap_enabled": true,
    "custom_css": "/* Iridescent Reverie signature weave */\nbody {\n    color: rgba(193, 236, 172, 1);\n    background-color: rgba(8, 73, 94, 0.7);\n    background-attachment: fixed;\n    overflow-x: hidden;\n}\n\nbody::before,\nbody::after {\n    content: '';\n    position: fixed;\n    inset: 0;\n    pointer-events: none;\n}\n\nbody {\n    background-image:\n        conic-gradient(from 242deg, rgba(193, 236, 172, 1), rgba(156, 209, 226, 1), rgba(226, 141, 212, 1), rgba(133, 214, 173, 1), rgba(193, 236, 172, 1)),\n        radial-gradient(circle at 70% 52%, rgba(133, 214, 173, 1) 0%, transparent 70%);\n    animation: iridescent-reverie-bg 17.37s ease-in-out infinite;\n    filter: saturate(150%) brightness(105%);\n}\n\nbody::before {\n    background: repeating-conic-gradient(from 119deg, transparent 0 15deg, rgba(206, 198, 188, 1.00) 15deg 30deg);\n    animation: iridescent-reverie-mesh 20.08s linear infinite;\n    mix-blend-mode: color-dodge;\n    opacity: 0.24;\n}\n\nbody::after {\n    background: radial-gradient(circle at center, transparent 0 35%, rgba(0, 0, 0, 0.55) 60%);\n    backdrop-filter: blur(8px) saturate(190%);\n    animation: iridescent-reverie-scan 10.99s ease-in-out infinite;\n    opacity: 0.36;\n}\n\n.mes, .mesText, .swipe-message {\n    background: linear-gradient(135deg, rgba(107, 6, 90, 0.68), rgba(7, 115, 61, 0.7));\n    border: 1px solid rgba(16, 122, 158, 0.88);\n    box-shadow: 0 0 34px rgba(133, 214, 173, 1);\n    backdrop-filter: blur(6.6px) saturate(180%);\n    transform-style: preserve-3d;\n    transition: transform 0.6s ease, box-shadow 0.6s ease;\n}\n\n.mes:hover {\n    transform: translateY(-6px) rotateX(-1.35deg) rotateY(2.67deg) scale(1.02);\n    box-shadow: 0 18px 48px rgba(156, 209, 226, 1);\n}\n\n.chat_mes_block .mes_text p code {\n    background: rgba(0, 0, 0, 0.45);\n    color: rgba(156, 209, 226, 1);\n    border-radius: 8px;\n    padding: 2px 6px;\n    box-shadow: 0 0 18px rgba(133, 214, 173, 1);\n}\n\n.chat_mes_block .mes_text blockquote {\n    border-left: 3px solid rgba(156, 209, 226, 1);\n    background: rgba(0, 0, 0, 0.32);\n    box-shadow: inset 0 0 18px rgba(133, 214, 173, 1);\n}\n\n.mes .avatar {\n    filter: drop-shadow(0 0 12px rgba(133, 214, 173, 1));\n}\n\n::selection {\n    background: rgba(156, 209, 226, 1);\n    color: rgba(193, 236, 172, 1);\n}\n\n@keyframes iridescent-reverie-bg {\n    0% { transform: scale(1) translate3d(0, 0, 0); }\n    50% { transform: scale(1.06) translate3d(2.12%, 1.77%, 0); }\n    100% { transform: scale(1.12) translate3d(2.87%, 3.11%, 0); }\n}\n\n@keyframes iridescent-reverie-orb {\n    0% { transform: translate3d(-3%, -3%, 0) scale(1); opacity: 0.18; }\n    50% { transform: translate3d(4%, 5%, 0) scale(1.08); opacity: 0.36; }\n    100% { transform: translate3d(-2%, 6%, 0) scale(1.02); opacity: 0.24; }\n}\n\n@keyframes iridescent-reverie-scan {\n    0% { transform: rotate(0deg); opacity: 0.12; }\n    50% { opacity: 0.28; }\n    100% { transform: rotate(360deg); opacity: 0.12; }\n}\n\n@keyframes iridescent-reverie-mesh {\n    0% { transform: translateY(-4%) scale(1); opacity: 0.2; }\n    50% { transform: translateY(4%) scale(1.06); opacity: 0.32; }\n    100% { transform: translateY(-6%) scale(1.02); opacity: 0.24; }\n}",
    "bogus_folders": true,
    "zoomed_avatar_magnification": false,
    "reduced_motion": true,
    "compact_input_area": true,
    "toastr_position": "toast-bottom-right",
    "show_swipe_num_all_messages": true,
    "click_to_edit": true,
    "notes": "Generatively enhanced CSS from update_theme_css.py"
}
