{
    "name": "Kaleido Overdrive",
    "blur_strength": 17,
    "main_text_color": "rgba(172, 206, 236, 1)",
    "italics_text_color": "rgba(226, 156, 223, 1)",
    "underline_text_color": "rgba(226, 224, 141, 1)",
    "quote_text_color": "rgba(157, 133, 214, 1)",
    "blur_tint_color": "rgba(6, 49, 86, 0.8)",
    "chat_tint_color": "rgba(94, 8, 90, 0.7)",
    "user_mes_blur_tint_color": "rgba(107, 103, 6, 0.68)",
    "bot_mes_blur_tint_color": "rgba(40, 7, 115, 0.7)",
    "shadow_color": "rgba(23, 130, 91, 0.82)",
    "shadow_width": 3,
    "border_color": "rgba(158, 16, 151, 0.88)",
    "font_scale": 1.05,
    "fast_ui_mode": true,
    "waifuMode": false,
    "avatar_style": 0,
    "chat_display": 2,
    "noShadows": false,
    "chat_width": 60,
    "timer_enabled": true,
    "timestamps_enabled": true,
    "timestamp_model_icon": false,
    "mesIDDisplay_enabled": true,
    "hideChatAvatars_enabled": false,
    "message_token_count_enabled": true,
    "expand_message_actions": false,
    "enableZenSliders": false,
    "enableLabMode": true,
    "hotswap_enabled": true,
    "custom_css": "/* Kaleido Overdrive signature weave */\nbody {\n    color: rgba(172, 206, 236, 1);\n    background-color: rgba(94, 8, 90, 0.7);\n    background-attachment: fixed;\n    overflow-x: hidden;\n}\n\nbody::before,\nbody::after {\n    content: '';\n    position: fixed;\n    inset: 0;\n    pointer-events: none;\n}\n\nbody {\n    background-image:\n        radial-gradient(circle at 31% 6%, rgba(226, 156, 223, 1) 0%, transparent 58%),\n        radial-gradient(circle at 0% 64%, rgba(172, 206, 236, 1) 0%, transparent 64%),\n        conic-gradient(from 171deg, rgba(172, 206, 236, 1), rgba(226, 224, 141, 1), rgba(226, 156, 223, 1), rgba(157, 133, 214, 1), rgba(172, 206, 236, 1));\n    animation: kaleido-overdrive-bg 14.77s ease-in-out infinite alternate;\n    backdrop-filter: saturate(145%) hue-rotate(21deg);\n}\n\nbody::before {\n    inset: -12vh;\n    background: radial-gradient(circle, rgba(194, 213, 198, 1.00) 0%, transparent 64%);\n    filter: blur(48px);\n    mix-blend-mode: screen;\n    animation: kaleido-overdrive-orb 25.66s ease-in-out infinite alternate;\n    opacity: 0.32;\n}\n\nbody::after {\n    background: linear-gradient(174deg, transparent 0 28%, rgba(198, 147, 219, 1.00) 48%, transparent 72%);\n    mix-blend-mode: color-dodge;\n    animation: kaleido-overdrive-scan 10.90s linear infinite;\n    opacity: 0.22;\n}\n\n.mes, .mesText, .swipe-message {\n    background: linear-gradient(135deg, rgba(107, 103, 6, 0.68), rgba(40, 7, 115, 0.7));\n    border: 1px solid rgba(158, 16, 151, 0.88);\n    box-shadow: 0 0 34px rgba(172, 206, 236, 1);\n    backdrop-filter: blur(11.9px) saturate(180%);\n    transform-style: preserve-3d;\n    transition: transform 0.6s ease, box-shadow 0.6s ease;\n}\n\n.mes:hover {\n    transform: translateY(-6px) rotateX(-1.89deg) rotateY(-2.68deg) scale(1.02);\n    box-shadow: 0 18px 48px rgba(226, 156, 223, 1);\n}\n\n.chat_mes_block .mes_text p code {\n    background: rgba(0, 0, 0, 0.45);\n    color: rgba(226, 156, 223, 1);\n    border-radius: 8px;\n    padding: 2px 6px;\n    box-shadow: 0 0 18px rgba(172, 206, 236, 1);\n}\n\n.chat_mes_block .mes_text blockquote {\n    border-left: 3px solid rgba(226, 156, 223, 1);\n    background: rgba(0, 0, 0, 0.32);\n    box-shadow: inset 0 0 18px rgba(172, 206, 236, 1);\n}\n\n.mes .avatar {\n    filter: drop-shadow(0 0 12px rgba(172, 206, 236, 1));\n}\n\n::selection {\n    background: rgba(226, 156, 223, 1);\n    color: rgba(172, 206, 236, 1);\n}\n\n@keyframes kaleido-overdrive-bg {\n    0% { transform: scale(1) translate3d(0, 0, 0); }\n    50% { transform: scale(1.06) translate3d(-0.70%, -2.89%, 0); }\n    100% { transform: scale(1.12) translate3d(-1.08%, 0.90%, 0); }\n}\n\n@keyframes kaleido-overdrive-orb {\n    0% { transform: translate3d(-3%, -3%, 0) scale(1); opacity: 0.18; }\n    50% { transform: translate3d(4%, 5%, 0) scale(1.08); opacity: 0.36; }\n    100% { transform: translate3d(-2%, 6%, 0) scale(1.02); opacity: 0.24; }\n}\n\n@keyframes kaleido-overdrive-scan {\n    0% { transform: rotate(0deg); opacity: 0.12; }\n    50% { opacity: 0.28; }\n    100% { transform: rotate(360deg); opacity: 0.12; }\n}\n\n@keyframes kaleido-overdrive-mesh {\n    0% { transform: translateY(-4%) scale(1); opacity: 0.2; }\n    50% { transform: translateY(4%) scale(1.06); opacity: 0.32; }\n    100% { transform: translateY(-6%) scale(1.02); opacity: 0.24; }\n}",
    "bogus_folders": false,
    "zoomed_avatar_magnification": false,
    "reduced_motion": false,
    "compact_input_area": false,
    "toastr_position": "toast-top-center",
    "show_swipe_num_all_messages": false,
    "click_to_edit": false,
    "notes": "Generatively enhanced CSS from update_theme_css.py"
}
