{
    "name": "Mirage Embers",
    "blur_strength": 7,
    "main_text_color": "rgba(172, 236, 177, 1)",
    "italics_text_color": "rgba(156, 181, 226, 1)",
    "underline_text_color": "rgba(226, 141, 178, 1)",
    "quote_text_color": "rgba(133, 214, 206, 1)",
    "blur_tint_color": "rgba(6, 86, 11, 0.8)",
    "chat_tint_color": "rgba(8, 38, 94, 0.7)",
    "user_mes_blur_tint_color": "rgba(107, 6, 49, 0.68)",
    "bot_mes_blur_tint_color": "rgba(7, 115, 104, 0.7)",
    "shadow_color": "rgba(105, 130, 23, 0.82)",
    "shadow_width": 4,
    "border_color": "rgba(16, 65, 158, 0.88)",
    "font_scale": 1.19,
    "fast_ui_mode": true,
    "waifuMode": false,
    "avatar_style": 2,
    "chat_display": 1,
    "noShadows": true,
    "chat_width": 64,
    "timer_enabled": true,
    "timestamps_enabled": true,
    "timestamp_model_icon": true,
    "mesIDDisplay_enabled": true,
    "hideChatAvatars_enabled": false,
    "message_token_count_enabled": true,
    "expand_message_actions": true,
    "enableZenSliders": true,
    "enableLabMode": true,
    "hotswap_enabled": true,
    "custom_css": "/* Mirage Embers signature weave */\nbody {\n    color: rgba(172, 236, 177, 1);\n    background-color: rgba(8, 38, 94, 0.7);\n    background-attachment: fixed;\n    overflow-x: hidden;\n}\n\nbody::before,\nbody::after {\n    content: '';\n    position: fixed;\n    inset: 0;\n    pointer-events: none;\n}\n\nbody {\n    background-image:\n        repeating-linear-gradient(110deg, transparent 0 40px, rgba(194, 198, 177, 1.00) 40px 80px),\n        radial-gradient(circle at 42% 36%, rgba(226, 141, 178, 1) 0%, transparent 55%),\n        linear-gradient(351deg, rgba(133, 214, 206, 1), rgba(156, 181, 226, 1));\n    animation: mirage-embers-bg 22.04s ease-in-out infinite alternate;\n    background-size: 120% 120%, cover, cover;\n    filter: contrast(110%) saturate(130%);\n}\n\nbody::before {\n    background: conic-gradient(from 87deg, transparent 0 25%, rgba(156, 181, 226, 1) 45%, transparent 75%);\n    animation: mirage-embers-mesh 21.67s linear infinite;\n    mix-blend-mode: lighten;\n    opacity: 0.25;\n}\n\nbody::after {\n    background: radial-gradient(ellipse at center, transparent 0 40%, rgba(0, 0, 0, 0.4) 70%, transparent 100%);\n    backdrop-filter: blur(6px) saturate(180%);\n    mix-blend-mode: soft-light;\n    animation: mirage-embers-scan 16.94s linear infinite;\n    opacity: 0.35;\n}\n\n.mes, .mesText, .swipe-message {\n    background: linear-gradient(135deg, rgba(107, 6, 49, 0.68), rgba(7, 115, 104, 0.7));\n    border: 1px solid rgba(16, 65, 158, 0.88);\n    box-shadow: 0 0 34px rgba(156, 181, 226, 1);\n    backdrop-filter: blur(5.5px) saturate(180%);\n    transform-style: preserve-3d;\n    transition: transform 0.6s ease, box-shadow 0.6s ease;\n}\n\n.mes:hover {\n    transform: translateY(-6px) rotateX(-0.88deg) rotateY(1.31deg) scale(1.02);\n    box-shadow: 0 18px 48px rgba(226, 141, 178, 1);\n}\n\n.chat_mes_block .mes_text p code {\n    background: rgba(0, 0, 0, 0.45);\n    color: rgba(226, 141, 178, 1);\n    border-radius: 8px;\n    padding: 2px 6px;\n    box-shadow: 0 0 18px rgba(156, 181, 226, 1);\n}\n\n.chat_mes_block .mes_text blockquote {\n    border-left: 3px solid rgba(226, 141, 178, 1);\n    background: rgba(0, 0, 0, 0.32);\n    box-shadow: inset 0 0 18px rgba(156, 181, 226, 1);\n}\n\n.mes .avatar {\n    filter: drop-shadow(0 0 12px rgba(156, 181, 226, 1));\n}\n\n::selection {\n    background: rgba(226, 141, 178, 1);\n    color: rgba(172, 236, 177, 1);\n}\n\n@keyframes mirage-embers-bg {\n    0% { transform: scale(1) translate3d(0, 0, 0); }\n    50% { transform: scale(1.06) translate3d(2.50%, 1.25%, 0); }\n    100% { transform: scale(1.12) translate3d(4.14%, -1.00%, 0); }\n}\n\n@keyframes mirage-embers-orb {\n    0% { transform: translate3d(-3%, -3%, 0) scale(1); opacity: 0.18; }\n    50% { transform: translate3d(4%, 5%, 0) scale(1.08); opacity: 0.36; }\n    100% { transform: translate3d(-2%, 6%, 0) scale(1.02); opacity: 0.24; }\n}\n\n@keyframes mirage-embers-scan {\n    0% { transform: rotate(0deg); opacity: 0.12; }\n    50% { opacity: 0.28; }\n    100% { transform: rotate(360deg); opacity: 0.12; }\n}\n\n@keyframes mirage-embers-mesh {\n    0% { transform: translateY(-4%) scale(1); opacity: 0.2; }\n    50% { transform: translateY(4%) scale(1.06); opacity: 0.32; }\n    100% { transform: translateY(-6%) scale(1.02); opacity: 0.24; }\n}",
    "bogus_folders": false,
    "zoomed_avatar_magnification": false,
    "reduced_motion": true,
    "compact_input_area": true,
    "toastr_position": "toast-bottom-right",
    "show_swipe_num_all_messages": false,
    "click_to_edit": true,
    "notes": "Generatively enhanced CSS from update_theme_css.py"
}
