{
    "name": "Phantom Reverie",
    "blur_strength": 9,
    "main_text_color": "rgba(176, 236, 172, 1)",
    "italics_text_color": "rgba(156, 189, 226, 1)",
    "underline_text_color": "rgba(226, 141, 188, 1)",
    "quote_text_color": "rgba(133, 214, 197, 1)",
    "blur_tint_color": "rgba(10, 86, 6, 0.8)",
    "chat_tint_color": "rgba(8, 48, 94, 0.7)",
    "user_mes_blur_tint_color": "rgba(107, 6, 61, 0.68)",
    "bot_mes_blur_tint_color": "rgba(7, 115, 92, 0.7)",
    "shadow_color": "rgba(118, 130, 23, 0.82)",
    "shadow_width": 4,
    "border_color": "rgba(16, 82, 158, 0.88)",
    "font_scale": 1.11,
    "fast_ui_mode": false,
    "waifuMode": true,
    "avatar_style": 2,
    "chat_display": 1,
    "noShadows": false,
    "chat_width": 52,
    "timer_enabled": true,
    "timestamps_enabled": false,
    "timestamp_model_icon": true,
    "mesIDDisplay_enabled": false,
    "hideChatAvatars_enabled": false,
    "message_token_count_enabled": false,
    "expand_message_actions": false,
    "enableZenSliders": false,
    "enableLabMode": false,
    "hotswap_enabled": true,
    "custom_css": "/* Phantom Reverie signature weave */\nbody {\n    color: rgba(176, 236, 172, 1);\n    background-color: rgba(8, 48, 94, 0.7);\n    background-attachment: fixed;\n    overflow-x: hidden;\n}\n\nbody::before,\nbody::after {\n    content: '';\n    position: fixed;\n    inset: 0;\n    pointer-events: none;\n}\n\nbody {\n    background-image:\n        radial-gradient(circle at 35% 81%, rgba(226, 141, 188, 1) 0%, transparent 58%),\n        radial-gradient(circle at 1% 54%, rgba(133, 214, 197, 1) 0%, transparent 64%),\n        conic-gradient(from 263deg, rgba(176, 236, 172, 1), rgba(226, 141, 188, 1), rgba(156, 189, 226, 1), rgba(133, 214, 197, 1), rgba(176, 236, 172, 1));\n    animation: phantom-reverie-bg 10.96s ease-in-out infinite alternate;\n    backdrop-filter: saturate(145%) hue-rotate(-154deg);\n}\n\nbody::before {\n    inset: -12vh;\n    background: radial-gradient(circle, rgba(196, 198, 178, 1.00) 0%, transparent 64%);\n    filter: blur(48px);\n    mix-blend-mode: screen;\n    animation: phantom-reverie-orb 11.81s ease-in-out infinite alternate;\n    opacity: 0.32;\n}\n\nbody::after {\n    background: linear-gradient(54deg, transparent 0 28%, rgba(147, 199, 214, 1.00) 48%, transparent 72%);\n    mix-blend-mode: color-dodge;\n    animation: phantom-reverie-scan 13.25s linear infinite;\n    opacity: 0.22;\n}\n\n.mes, .mesText, .swipe-message {\n    background: linear-gradient(135deg, rgba(107, 6, 61, 0.68), rgba(7, 115, 92, 0.7));\n    border: 1px solid rgba(16, 82, 158, 0.88);\n    box-shadow: 0 0 34px rgba(133, 214, 197, 1);\n    backdrop-filter: blur(5.3px) saturate(180%);\n    transform-style: preserve-3d;\n    transition: transform 0.6s ease, box-shadow 0.6s ease;\n}\n\n.mes:hover {\n    transform: translateY(-6px) rotateX(2.56deg) rotateY(1.57deg) scale(1.02);\n    box-shadow: 0 18px 48px rgba(226, 141, 188, 1);\n}\n\n.chat_mes_block .mes_text p code {\n    background: rgba(0, 0, 0, 0.45);\n    color: rgba(226, 141, 188, 1);\n    border-radius: 8px;\n    padding: 2px 6px;\n    box-shadow: 0 0 18px rgba(133, 214, 197, 1);\n}\n\n.chat_mes_block .mes_text blockquote {\n    border-left: 3px solid rgba(226, 141, 188, 1);\n    background: rgba(0, 0, 0, 0.32);\n    box-shadow: inset 0 0 18px rgba(133, 214, 197, 1);\n}\n\n.mes .avatar {\n    filter: drop-shadow(0 0 12px rgba(133, 214, 197, 1));\n}\n\n::selection {\n    background: rgba(226, 141, 188, 1);\n    color: rgba(176, 236, 172, 1);\n}\n\n@keyframes phantom-reverie-bg {\n    0% { transform: scale(1) translate3d(0, 0, 0); }\n    50% { transform: scale(1.06) translate3d(-1.28%, -0.02%, 0); }\n    100% { transform: scale(1.12) translate3d(4.05%, 3.28%, 0); }\n}\n\n@keyframes phantom-reverie-orb {\n    0% { transform: translate3d(-3%, -3%, 0) scale(1); opacity: 0.18; }\n    50% { transform: translate3d(4%, 5%, 0) scale(1.08); opacity: 0.36; }\n    100% { transform: translate3d(-2%, 6%, 0) scale(1.02); opacity: 0.24; }\n}\n\n@keyframes phantom-reverie-scan {\n    0% { transform: rotate(0deg); opacity: 0.12; }\n    50% { opacity: 0.28; }\n    100% { transform: rotate(360deg); opacity: 0.12; }\n}\n\n@keyframes phantom-reverie-mesh {\n    0% { transform: translateY(-4%) scale(1); opacity: 0.2; }\n    50% { transform: translateY(4%) scale(1.06); opacity: 0.32; }\n    100% { transform: translateY(-6%) scale(1.02); opacity: 0.24; }\n}",
    "bogus_folders": false,
    "zoomed_avatar_magnification": true,
    "reduced_motion": true,
    "compact_input_area": true,
    "toastr_position": "toast-bottom-left",
    "show_swipe_num_all_messages": false,
    "click_to_edit": false,
    "notes": "Generatively enhanced CSS from update_theme_css.py"
}
