{
    "name": "Quantum Sanctuary",
    "blur_strength": 19,
    "main_text_color": "rgba(236, 222, 172, 1)",
    "italics_text_color": "rgba(156, 226, 182, 1)",
    "underline_text_color": "rgba(165, 141, 226, 1)",
    "quote_text_color": "rgba(164, 214, 133, 1)",
    "blur_tint_color": "rgba(86, 69, 6, 0.8)",
    "chat_tint_color": "rgba(8, 94, 39, 0.7)",
    "user_mes_blur_tint_color": "rgba(34, 6, 107, 0.68)",
    "bot_mes_blur_tint_color": "rgba(49, 115, 7, 0.7)",
    "shadow_color": "rgba(130, 23, 28, 0.82)",
    "shadow_width": 4,
    "border_color": "rgba(16, 158, 68, 0.88)",
    "font_scale": 1.17,
    "fast_ui_mode": true,
    "waifuMode": false,
    "avatar_style": 1,
    "chat_display": 1,
    "noShadows": false,
    "chat_width": 54,
    "timer_enabled": false,
    "timestamps_enabled": true,
    "timestamp_model_icon": true,
    "mesIDDisplay_enabled": false,
    "hideChatAvatars_enabled": true,
    "message_token_count_enabled": true,
    "expand_message_actions": true,
    "enableZenSliders": false,
    "enableLabMode": true,
    "hotswap_enabled": true,
    "custom_css": "/* Quantum Sanctuary signature weave */\nbody {\n    color: rgba(236, 222, 172, 1);\n    background-color: rgba(8, 94, 39, 0.7);\n    background-attachment: fixed;\n    overflow-x: hidden;\n}\n\nbody::before,\nbody::after {\n    content: '';\n    position: fixed;\n    inset: 0;\n    pointer-events: none;\n}\n\nbody {\n    background-image:\n        radial-gradient(circle at 18% 21%, rgba(156, 226, 182, 1) 0%, transparent 58%),\n        radial-gradient(circle at 3% 22%, rgba(156, 226, 182, 1) 0%, transparent 64%),\n        conic-gradient(from 96deg, rgba(236, 222, 172, 1), rgba(165, 141, 226, 1), rgba(156, 226, 182, 1), rgba(164, 214, 133, 1), rgba(236, 222, 172, 1));\n    animation: quantum-sanctuary-bg 21.00s ease-in-out infinite alternate;\n    backdrop-filter: saturate(145%) hue-rotate(-3deg);\n}\n\nbody::before {\n    inset: -12vh;\n    background: radial-gradient(circle, rgba(208, 190, 194, 1.00) 0%, transparent 64%);\n    filter: blur(48px);\n    mix-blend-mode: screen;\n    animation: quantum-sanctuary-orb 27.32s ease-in-out infinite alternate;\n    opacity: 0.32;\n}\n\nbody::after {\n    background: linear-gradient(25deg, transparent 0 28%, rgba(159, 221, 162, 1.00) 48%, transparent 72%);\n    mix-blend-mode: color-dodge;\n    animation: quantum-sanctuary-scan 7.81s linear infinite;\n    opacity: 0.22;\n}\n\n.mes, .mesText, .swipe-message {\n    background: linear-gradient(135deg, rgba(34, 6, 107, 0.68), rgba(49, 115, 7, 0.7));\n    border: 1px solid rgba(16, 158, 68, 0.88);\n    box-shadow: 0 0 34px rgba(156, 226, 182, 1);\n    backdrop-filter: blur(9.3px) saturate(180%);\n    transform-style: preserve-3d;\n    transition: transform 0.6s ease, box-shadow 0.6s ease;\n}\n\n.mes:hover {\n    transform: translateY(-6px) rotateX(-1.59deg) rotateY(-0.94deg) scale(1.02);\n    box-shadow: 0 18px 48px rgba(156, 226, 182, 1);\n}\n\n.chat_mes_block .mes_text p code {\n    background: rgba(0, 0, 0, 0.45);\n    color: rgba(156, 226, 182, 1);\n    border-radius: 8px;\n    padding: 2px 6px;\n    box-shadow: 0 0 18px rgba(156, 226, 182, 1);\n}\n\n.chat_mes_block .mes_text blockquote {\n    border-left: 3px solid rgba(156, 226, 182, 1);\n    background: rgba(0, 0, 0, 0.32);\n    box-shadow: inset 0 0 18px rgba(156, 226, 182, 1);\n}\n\n.mes .avatar {\n    filter: drop-shadow(0 0 12px rgba(156, 226, 182, 1));\n}\n\n::selection {\n    background: rgba(156, 226, 182, 1);\n    color: rgba(236, 222, 172, 1);\n}\n\n@keyframes quantum-sanctuary-bg {\n    0% { transform: scale(1) translate3d(0, 0, 0); }\n    50% { transform: scale(1.06) translate3d(-2.85%, -1.31%, 0); }\n    100% { transform: scale(1.12) translate3d(1.96%, -0.82%, 0); }\n}\n\n@keyframes quantum-sanctuary-orb {\n    0% { transform: translate3d(-3%, -3%, 0) scale(1); opacity: 0.18; }\n    50% { transform: translate3d(4%, 5%, 0) scale(1.08); opacity: 0.36; }\n    100% { transform: translate3d(-2%, 6%, 0) scale(1.02); opacity: 0.24; }\n}\n\n@keyframes quantum-sanctuary-scan {\n    0% { transform: rotate(0deg); opacity: 0.12; }\n    50% { opacity: 0.28; }\n    100% { transform: rotate(360deg); opacity: 0.12; }\n}\n\n@keyframes quantum-sanctuary-mesh {\n    0% { transform: translateY(-4%) scale(1); opacity: 0.2; }\n    50% { transform: translateY(4%) scale(1.06); opacity: 0.32; }\n    100% { transform: translateY(-6%) scale(1.02); opacity: 0.24; }\n}",
    "bogus_folders": false,
    "zoomed_avatar_magnification": false,
    "reduced_motion": false,
    "compact_input_area": true,
    "toastr_position": "toast-bottom-left",
    "show_swipe_num_all_messages": false,
    "click_to_edit": true,
    "notes": "Generatively enhanced CSS from update_theme_css.py"
}
