{
    "name": "Shimmer Phantom",
    "blur_strength": 7,
    "main_text_color": "rgba(236, 225, 172, 1)",
    "italics_text_color": "rgba(156, 226, 185, 1)",
    "underline_text_color": "rgba(169, 141, 226, 1)",
    "quote_text_color": "rgba(160, 214, 133, 1)",
    "blur_tint_color": "rgba(86, 73, 6, 0.8)",
    "chat_tint_color": "rgba(8, 94, 44, 0.7)",
    "user_mes_blur_tint_color": "rgba(39, 6, 107, 0.68)",
    "bot_mes_blur_tint_color": "rgba(43, 115, 7, 0.7)",
    "shadow_color": "rgba(130, 23, 23, 0.82)",
    "shadow_width": 2,
    "border_color": "rgba(16, 158, 75, 0.88)",
    "font_scale": 1.0,
    "fast_ui_mode": false,
    "waifuMode": false,
    "avatar_style": 1,
    "chat_display": 0,
    "noShadows": false,
    "chat_width": 50,
    "timer_enabled": true,
    "timestamps_enabled": true,
    "timestamp_model_icon": true,
    "mesIDDisplay_enabled": true,
    "hideChatAvatars_enabled": false,
    "message_token_count_enabled": false,
    "expand_message_actions": true,
    "enableZenSliders": true,
    "enableLabMode": false,
    "hotswap_enabled": true,
    "custom_css": "/* Shimmer Phantom signature weave */\nbody {\n    color: rgba(236, 225, 172, 1);\n    background-color: rgba(8, 94, 44, 0.7);\n    background-attachment: fixed;\n    overflow-x: hidden;\n}\n\nbody::before,\nbody::after {\n    content: '';\n    position: fixed;\n    inset: 0;\n    pointer-events: none;\n}\n\nbody {\n    background-image:\n        conic-gradient(from 234deg, rgba(236, 225, 172, 1), rgba(169, 141, 226, 1), rgba(169, 141, 226, 1), rgba(160, 214, 133, 1), rgba(236, 225, 172, 1)),\n        radial-gradient(circle at 4% 13%, rgba(156, 226, 185, 1) 0%, transparent 70%);\n    animation: shimmer-phantom-bg 19.80s ease-in-out infinite;\n    filter: saturate(150%) brightness(105%);\n}\n\nbody::before {\n    background: repeating-conic-gradient(from 2deg, transparent 0 15deg, rgba(209, 191, 194, 1.00) 15deg 30deg);\n    animation: shimmer-phantom-mesh 26.67s linear infinite;\n    mix-blend-mode: color-dodge;\n    opacity: 0.24;\n}\n\nbody::after {\n    background: radial-gradient(circle at center, transparent 0 35%, rgba(0, 0, 0, 0.55) 60%);\n    backdrop-filter: blur(8px) saturate(190%);\n    animation: shimmer-phantom-scan 15.77s ease-in-out infinite;\n    opacity: 0.36;\n}\n\n.mes, .mesText, .swipe-message {\n    background: linear-gradient(135deg, rgba(39, 6, 107, 0.68), rgba(43, 115, 7, 0.7));\n    border: 1px solid rgba(16, 158, 75, 0.88);\n    box-shadow: 0 0 34px rgba(156, 226, 185, 1);\n    backdrop-filter: blur(7.9px) saturate(180%);\n    transform-style: preserve-3d;\n    transition: transform 0.6s ease, box-shadow 0.6s ease;\n}\n\n.mes:hover {\n    transform: translateY(-6px) rotateX(-2.06deg) rotateY(-0.70deg) scale(1.02);\n    box-shadow: 0 18px 48px rgba(169, 141, 226, 1);\n}\n\n.chat_mes_block .mes_text p code {\n    background: rgba(0, 0, 0, 0.45);\n    color: rgba(169, 141, 226, 1);\n    border-radius: 8px;\n    padding: 2px 6px;\n    box-shadow: 0 0 18px rgba(156, 226, 185, 1);\n}\n\n.chat_mes_block .mes_text blockquote {\n    border-left: 3px solid rgba(169, 141, 226, 1);\n    background: rgba(0, 0, 0, 0.32);\n    box-shadow: inset 0 0 18px rgba(156, 226, 185, 1);\n}\n\n.mes .avatar {\n    filter: drop-shadow(0 0 12px rgba(156, 226, 185, 1));\n}\n\n::selection {\n    background: rgba(169, 141, 226, 1);\n    color: rgba(236, 225, 172, 1);\n}\n\n@keyframes shimmer-phantom-bg {\n    0% { transform: scale(1) translate3d(0, 0, 0); }\n    50% { transform: scale(1.06) translate3d(0.73%, -2.49%, 0); }\n    100% { transform: scale(1.12) translate3d(-1.46%, -4.13%, 0); }\n}\n\n@keyframes shimmer-phantom-orb {\n    0% { transform: translate3d(-3%, -3%, 0) scale(1); opacity: 0.18; }\n    50% { transform: translate3d(4%, 5%, 0) scale(1.08); opacity: 0.36; }\n    100% { transform: translate3d(-2%, 6%, 0) scale(1.02); opacity: 0.24; }\n}\n\n@keyframes shimmer-phantom-scan {\n    0% { transform: rotate(0deg); opacity: 0.12; }\n    50% { opacity: 0.28; }\n    100% { transform: rotate(360deg); opacity: 0.12; }\n}\n\n@keyframes shimmer-phantom-mesh {\n    0% { transform: translateY(-4%) scale(1); opacity: 0.2; }\n    50% { transform: translateY(4%) scale(1.06); opacity: 0.32; }\n    100% { transform: translateY(-6%) scale(1.02); opacity: 0.24; }\n}",
    "bogus_folders": true,
    "zoomed_avatar_magnification": false,
    "reduced_motion": true,
    "compact_input_area": false,
    "toastr_position": "toast-bottom-right",
    "show_swipe_num_all_messages": false,
    "click_to_edit": false,
    "notes": "Generatively enhanced CSS from update_theme_css.py"
}
