{
    "name": "Spectrum Pulsegrid",
    "blur_strength": 17,
    "main_text_color": "rgba(172, 236, 212, 1)",
    "italics_text_color": "rgba(171, 156, 226, 1)",
    "underline_text_color": "rgba(226, 152, 141, 1)",
    "quote_text_color": "rgba(133, 176, 214, 1)",
    "blur_tint_color": "rgba(6, 86, 57, 0.8)",
    "chat_tint_color": "rgba(26, 8, 94, 0.7)",
    "user_mes_blur_tint_color": "rgba(107, 19, 6, 0.68)",
    "bot_mes_blur_tint_color": "rgba(7, 65, 115, 0.7)",
    "shadow_color": "rgba(44, 130, 23, 0.82)",
    "shadow_width": 5,
    "border_color": "rgba(46, 16, 158, 0.88)",
    "font_scale": 1.08,
    "fast_ui_mode": false,
    "waifuMode": true,
    "avatar_style": 1,
    "chat_display": 0,
    "noShadows": false,
    "chat_width": 57,
    "timer_enabled": true,
    "timestamps_enabled": false,
    "timestamp_model_icon": false,
    "mesIDDisplay_enabled": true,
    "hideChatAvatars_enabled": false,
    "message_token_count_enabled": true,
    "expand_message_actions": true,
    "enableZenSliders": false,
    "enableLabMode": false,
    "hotswap_enabled": true,
    "custom_css": "/* Spectrum Pulsegrid signature weave */\nbody {\n    color: rgba(172, 236, 212, 1);\n    background-color: rgba(26, 8, 94, 0.7);\n    background-attachment: fixed;\n    overflow-x: hidden;\n}\n\nbody::before,\nbody::after {\n    content: '';\n    position: fixed;\n    inset: 0;\n    pointer-events: none;\n}\n\nbody {\n    background-image:\n        conic-gradient(from 279deg, rgba(172, 236, 212, 1), rgba(172, 236, 212, 1), rgba(226, 152, 141, 1), rgba(133, 176, 214, 1), rgba(172, 236, 212, 1)),\n        radial-gradient(circle at 11% 38%, rgba(172, 236, 212, 1) 0%, transparent 70%);\n    animation: spectrum-pulsegrid-bg 23.52s ease-in-out infinite;\n    filter: saturate(150%) brightness(105%);\n}\n\nbody::before {\n    background: repeating-conic-gradient(from 141deg, transparent 0 15deg, rgba(194, 202, 184, 1.00) 15deg 30deg);\n    animation: spectrum-pulsegrid-mesh 13.35s linear infinite;\n    mix-blend-mode: color-dodge;\n    opacity: 0.24;\n}\n\nbody::after {\n    background: radial-gradient(circle at center, transparent 0 35%, rgba(0, 0, 0, 0.55) 60%);\n    backdrop-filter: blur(8px) saturate(190%);\n    animation: spectrum-pulsegrid-scan 8.00s ease-in-out infinite;\n    opacity: 0.36;\n}\n\n.mes, .mesText, .swipe-message {\n    background: linear-gradient(135deg, rgba(107, 19, 6, 0.68), rgba(7, 65, 115, 0.7));\n    border: 1px solid rgba(46, 16, 158, 0.88);\n    box-shadow: 0 0 34px rgba(172, 236, 212, 1);\n    backdrop-filter: blur(8.4px) saturate(180%);\n    transform-style: preserve-3d;\n    transition: transform 0.6s ease, box-shadow 0.6s ease;\n}\n\n.mes:hover {\n    transform: translateY(-6px) rotateX(-1.37deg) rotateY(-0.93deg) scale(1.02);\n    box-shadow: 0 18px 48px rgba(172, 236, 212, 1);\n}\n\n.chat_mes_block .mes_text p code {\n    background: rgba(0, 0, 0, 0.45);\n    color: rgba(172, 236, 212, 1);\n    border-radius: 8px;\n    padding: 2px 6px;\n    box-shadow: 0 0 18px rgba(172, 236, 212, 1);\n}\n\n.chat_mes_block .mes_text blockquote {\n    border-left: 3px solid rgba(172, 236, 212, 1);\n    background: rgba(0, 0, 0, 0.32);\n    box-shadow: inset 0 0 18px rgba(172, 236, 212, 1);\n}\n\n.mes .avatar {\n    filter: drop-shadow(0 0 12px rgba(172, 236, 212, 1));\n}\n\n::selection {\n    background: rgba(172, 236, 212, 1);\n    color: rgba(172, 236, 212, 1);\n}\n\n@keyframes spectrum-pulsegrid-bg {\n    0% { transform: scale(1) translate3d(0, 0, 0); }\n    50% { transform: scale(1.06) translate3d(-2.18%, -1.51%, 0); }\n    100% { transform: scale(1.12) translate3d(-2.26%, 0.85%, 0); }\n}\n\n@keyframes spectrum-pulsegrid-orb {\n    0% { transform: translate3d(-3%, -3%, 0) scale(1); opacity: 0.18; }\n    50% { transform: translate3d(4%, 5%, 0) scale(1.08); opacity: 0.36; }\n    100% { transform: translate3d(-2%, 6%, 0) scale(1.02); opacity: 0.24; }\n}\n\n@keyframes spectrum-pulsegrid-scan {\n    0% { transform: rotate(0deg); opacity: 0.12; }\n    50% { opacity: 0.28; }\n    100% { transform: rotate(360deg); opacity: 0.12; }\n}\n\n@keyframes spectrum-pulsegrid-mesh {\n    0% { transform: translateY(-4%) scale(1); opacity: 0.2; }\n    50% { transform: translateY(4%) scale(1.06); opacity: 0.32; }\n    100% { transform: translateY(-6%) scale(1.02); opacity: 0.24; }\n}",
    "bogus_folders": true,
    "zoomed_avatar_magnification": false,
    "reduced_motion": true,
    "compact_input_area": true,
    "toastr_position": "toast-bottom-right",
    "show_swipe_num_all_messages": false,
    "click_to_edit": true,
    "notes": "Generatively enhanced CSS from update_theme_css.py"
}
