{
    "name": "Spectrum Reactor",
    "blur_strength": 14,
    "main_text_color": "rgba(228, 236, 172, 1)",
    "italics_text_color": "rgba(156, 226, 205, 1)",
    "underline_text_color": "rgba(194, 141, 226, 1)",
    "quote_text_color": "rgba(137, 214, 133, 1)",
    "blur_tint_color": "rgba(77, 86, 6, 0.8)",
    "chat_tint_color": "rgba(8, 94, 68, 0.7)",
    "user_mes_blur_tint_color": "rgba(68, 6, 107, 0.68)",
    "bot_mes_blur_tint_color": "rgba(13, 115, 7, 0.7)",
    "shadow_color": "rgba(130, 53, 23, 0.82)",
    "shadow_width": 6,
    "border_color": "rgba(16, 158, 115, 0.88)",
    "font_scale": 1.09,
    "fast_ui_mode": true,
    "waifuMode": false,
    "avatar_style": 1,
    "chat_display": 0,
    "noShadows": false,
    "chat_width": 53,
    "timer_enabled": true,
    "timestamps_enabled": false,
    "timestamp_model_icon": true,
    "mesIDDisplay_enabled": true,
    "hideChatAvatars_enabled": true,
    "message_token_count_enabled": true,
    "expand_message_actions": false,
    "enableZenSliders": true,
    "enableLabMode": true,
    "hotswap_enabled": true,
    "custom_css": "/* Spectrum Reactor signature weave */\nbody {\n    color: rgba(228, 236, 172, 1);\n    background-color: rgba(8, 94, 68, 0.7);\n    background-attachment: fixed;\n    overflow-x: hidden;\n}\n\nbody::before,\nbody::after {\n    content: '';\n    position: fixed;\n    inset: 0;\n    pointer-events: none;\n}\n\nbody {\n    background-image:\n        conic-gradient(from 201deg, rgba(228, 236, 172, 1), rgba(156, 226, 205, 1), rgba(194, 141, 226, 1), rgba(137, 214, 133, 1), rgba(228, 236, 172, 1)),\n        radial-gradient(circle at 36% 70%, rgba(228, 236, 172, 1) 0%, transparent 70%);\n    animation: spectrum-reactor-bg 8.47s ease-in-out infinite;\n    filter: saturate(150%) brightness(105%);\n}\n\nbody::before {\n    background: repeating-conic-gradient(from 251deg, transparent 0 15deg, rgba(214, 198, 194, 1.00) 15deg 30deg);\n    animation: spectrum-reactor-mesh 27.45s linear infinite;\n    mix-blend-mode: color-dodge;\n    opacity: 0.24;\n}\n\nbody::after {\n    background: radial-gradient(circle at center, transparent 0 35%, rgba(0, 0, 0, 0.55) 60%);\n    backdrop-filter: blur(8px) saturate(190%);\n    animation: spectrum-reactor-scan 13.85s ease-in-out infinite;\n    opacity: 0.36;\n}\n\n.mes, .mesText, .swipe-message {\n    background: linear-gradient(135deg, rgba(68, 6, 107, 0.68), rgba(13, 115, 7, 0.7));\n    border: 1px solid rgba(16, 158, 115, 0.88);\n    box-shadow: 0 0 34px rgba(228, 236, 172, 1);\n    backdrop-filter: blur(5.5px) saturate(180%);\n    transform-style: preserve-3d;\n    transition: transform 0.6s ease, box-shadow 0.6s ease;\n}\n\n.mes:hover {\n    transform: translateY(-6px) rotateX(-0.81deg) rotateY(-1.00deg) scale(1.02);\n    box-shadow: 0 18px 48px rgba(156, 226, 205, 1);\n}\n\n.chat_mes_block .mes_text p code {\n    background: rgba(0, 0, 0, 0.45);\n    color: rgba(156, 226, 205, 1);\n    border-radius: 8px;\n    padding: 2px 6px;\n    box-shadow: 0 0 18px rgba(228, 236, 172, 1);\n}\n\n.chat_mes_block .mes_text blockquote {\n    border-left: 3px solid rgba(156, 226, 205, 1);\n    background: rgba(0, 0, 0, 0.32);\n    box-shadow: inset 0 0 18px rgba(228, 236, 172, 1);\n}\n\n.mes .avatar {\n    filter: drop-shadow(0 0 12px rgba(228, 236, 172, 1));\n}\n\n::selection {\n    background: rgba(156, 226, 205, 1);\n    color: rgba(228, 236, 172, 1);\n}\n\n@keyframes spectrum-reactor-bg {\n    0% { transform: scale(1) translate3d(0, 0, 0); }\n    50% { transform: scale(1.06) translate3d(2.14%, -2.51%, 0); }\n    100% { transform: scale(1.12) translate3d(0.68%, 2.80%, 0); }\n}\n\n@keyframes spectrum-reactor-orb {\n    0% { transform: translate3d(-3%, -3%, 0) scale(1); opacity: 0.18; }\n    50% { transform: translate3d(4%, 5%, 0) scale(1.08); opacity: 0.36; }\n    100% { transform: translate3d(-2%, 6%, 0) scale(1.02); opacity: 0.24; }\n}\n\n@keyframes spectrum-reactor-scan {\n    0% { transform: rotate(0deg); opacity: 0.12; }\n    50% { opacity: 0.28; }\n    100% { transform: rotate(360deg); opacity: 0.12; }\n}\n\n@keyframes spectrum-reactor-mesh {\n    0% { transform: translateY(-4%) scale(1); opacity: 0.2; }\n    50% { transform: translateY(4%) scale(1.06); opacity: 0.32; }\n    100% { transform: translateY(-6%) scale(1.02); opacity: 0.24; }\n}",
    "bogus_folders": true,
    "zoomed_avatar_magnification": true,
    "reduced_motion": false,
    "compact_input_area": true,
    "toastr_position": "toast-bottom-right",
    "show_swipe_num_all_messages": true,
    "click_to_edit": true,
    "notes": "Generatively enhanced CSS from update_theme_css.py"
}
