{
    "name": "Turbo Haze",
    "blur_strength": 17,
    "main_text_color": "rgba(236, 172, 223, 1)",
    "italics_text_color": "rgba(226, 211, 156, 1)",
    "underline_text_color": "rgba(141, 226, 201, 1)",
    "quote_text_color": "rgba(214, 135, 133, 1)",
    "blur_tint_color": "rgba(86, 6, 70, 0.8)",
    "chat_tint_color": "rgba(94, 76, 8, 0.7)",
    "user_mes_blur_tint_color": "rgba(6, 107, 76, 0.68)",
    "bot_mes_blur_tint_color": "rgba(115, 11, 7, 0.7)",
    "shadow_color": "rgba(62, 23, 130, 0.82)",
    "shadow_width": 3,
    "border_color": "rgba(158, 127, 16, 0.88)",
    "font_scale": 1.07,
    "fast_ui_mode": false,
    "waifuMode": false,
    "avatar_style": 2,
    "chat_display": 0,
    "noShadows": false,
    "chat_width": 52,
    "timer_enabled": true,
    "timestamps_enabled": true,
    "timestamp_model_icon": false,
    "mesIDDisplay_enabled": false,
    "hideChatAvatars_enabled": true,
    "message_token_count_enabled": false,
    "expand_message_actions": true,
    "enableZenSliders": true,
    "enableLabMode": true,
    "hotswap_enabled": true,
    "custom_css": "/* Turbo Haze signature weave */\nbody {\n    color: rgba(236, 172, 223, 1);\n    background-color: rgba(94, 76, 8, 0.7);\n    background-attachment: fixed;\n    overflow-x: hidden;\n}\n\nbody::before,\nbody::after {\n    content: '';\n    position: fixed;\n    inset: 0;\n    pointer-events: none;\n}\n\nbody {\n    background-image:\n        radial-gradient(circle at 37% 35%, rgba(141, 226, 201, 1) 0%, transparent 58%),\n        radial-gradient(circle at 11% 2%, rgba(214, 135, 133, 1) 0%, transparent 64%),\n        conic-gradient(from 279deg, rgba(236, 172, 223, 1), rgba(141, 226, 201, 1), rgba(226, 211, 156, 1), rgba(214, 135, 133, 1), rgba(236, 172, 223, 1));\n    animation: turbo-haze-bg 25.18s ease-in-out infinite alternate;\n    backdrop-filter: saturate(145%) hue-rotate(-115deg);\n}\n\nbody::before {\n    inset: -12vh;\n    background: radial-gradient(circle, rgba(198, 194, 214, 1.00) 0%, transparent 64%);\n    filter: blur(48px);\n    mix-blend-mode: screen;\n    animation: turbo-haze-orb 10.46s ease-in-out infinite alternate;\n    opacity: 0.32;\n}\n\nbody::after {\n    background: linear-gradient(62deg, transparent 0 28%, rgba(221, 181, 147, 1.00) 48%, transparent 72%);\n    mix-blend-mode: color-dodge;\n    animation: turbo-haze-scan 11.33s linear infinite;\n    opacity: 0.22;\n}\n\n.mes, .mesText, .swipe-message {\n    background: linear-gradient(135deg, rgba(6, 107, 76, 0.68), rgba(115, 11, 7, 0.7));\n    border: 1px solid rgba(158, 127, 16, 0.88);\n    box-shadow: 0 0 34px rgba(214, 135, 133, 1);\n    backdrop-filter: blur(11.5px) saturate(180%);\n    transform-style: preserve-3d;\n    transition: transform 0.6s ease, box-shadow 0.6s ease;\n}\n\n.mes:hover {\n    transform: translateY(-6px) rotateX(-0.30deg) rotateY(-2.20deg) scale(1.02);\n    box-shadow: 0 18px 48px rgba(141, 226, 201, 1);\n}\n\n.chat_mes_block .mes_text p code {\n    background: rgba(0, 0, 0, 0.45);\n    color: rgba(141, 226, 201, 1);\n    border-radius: 8px;\n    padding: 2px 6px;\n    box-shadow: 0 0 18px rgba(214, 135, 133, 1);\n}\n\n.chat_mes_block .mes_text blockquote {\n    border-left: 3px solid rgba(141, 226, 201, 1);\n    background: rgba(0, 0, 0, 0.32);\n    box-shadow: inset 0 0 18px rgba(214, 135, 133, 1);\n}\n\n.mes .avatar {\n    filter: drop-shadow(0 0 12px rgba(214, 135, 133, 1));\n}\n\n::selection {\n    background: rgba(141, 226, 201, 1);\n    color: rgba(236, 172, 223, 1);\n}\n\n@keyframes turbo-haze-bg {\n    0% { transform: scale(1) translate3d(0, 0, 0); }\n    50% { transform: scale(1.06) translate3d(-0.48%, -2.36%, 0); }\n    100% { transform: scale(1.12) translate3d(-3.69%, -0.35%, 0); }\n}\n\n@keyframes turbo-haze-orb {\n    0% { transform: translate3d(-3%, -3%, 0) scale(1); opacity: 0.18; }\n    50% { transform: translate3d(4%, 5%, 0) scale(1.08); opacity: 0.36; }\n    100% { transform: translate3d(-2%, 6%, 0) scale(1.02); opacity: 0.24; }\n}\n\n@keyframes turbo-haze-scan {\n    0% { transform: rotate(0deg); opacity: 0.12; }\n    50% { opacity: 0.28; }\n    100% { transform: rotate(360deg); opacity: 0.12; }\n}\n\n@keyframes turbo-haze-mesh {\n    0% { transform: translateY(-4%) scale(1); opacity: 0.2; }\n    50% { transform: translateY(4%) scale(1.06); opacity: 0.32; }\n    100% { transform: translateY(-6%) scale(1.02); opacity: 0.24; }\n}",
    "bogus_folders": true,
    "zoomed_avatar_magnification": true,
    "reduced_motion": true,
    "compact_input_area": true,
    "toastr_position": "toast-top-center",
    "show_swipe_num_all_messages": false,
    "click_to_edit": true,
    "notes": "Generatively enhanced CSS from update_theme_css.py"
}
