{
    "name": "Velvet Prism",
    "blur_strength": 13,
    "main_text_color": "rgba(172, 236, 173, 1)",
    "italics_text_color": "rgba(156, 184, 226, 1)",
    "underline_text_color": "rgba(226, 141, 182, 1)",
    "quote_text_color": "rgba(133, 214, 202, 1)",
    "blur_tint_color": "rgba(6, 86, 7, 0.8)",
    "chat_tint_color": "rgba(8, 42, 94, 0.7)",
    "user_mes_blur_tint_color": "rgba(107, 6, 54, 0.68)",
    "bot_mes_blur_tint_color": "rgba(7, 115, 99, 0.7)",
    "shadow_color": "rgba(110, 130, 23, 0.82)",
    "shadow_width": 4,
    "border_color": "rgba(16, 72, 158, 0.88)",
    "font_scale": 1.18,
    "fast_ui_mode": false,
    "waifuMode": true,
    "avatar_style": 1,
    "chat_display": 0,
    "noShadows": true,
    "chat_width": 59,
    "timer_enabled": true,
    "timestamps_enabled": true,
    "timestamp_model_icon": true,
    "mesIDDisplay_enabled": true,
    "hideChatAvatars_enabled": false,
    "message_token_count_enabled": false,
    "expand_message_actions": false,
    "enableZenSliders": true,
    "enableLabMode": true,
    "hotswap_enabled": false,
    "custom_css": "/* Velvet Prism signature weave */\nbody {\n    color: rgba(172, 236, 173, 1);\n    background-color: rgba(8, 42, 94, 0.7);\n    background-attachment: fixed;\n    overflow-x: hidden;\n}\n\nbody::before,\nbody::after {\n    content: '';\n    position: fixed;\n    inset: 0;\n    pointer-events: none;\n}\n\nbody {\n    background-image:\n        radial-gradient(circle at 35% 22%, rgba(133, 214, 202, 1) 0%, transparent 58%),\n        radial-gradient(circle at 30% 34%, rgba(226, 141, 182, 1) 0%, transparent 64%),\n        conic-gradient(from 63deg, rgba(172, 236, 173, 1), rgba(226, 141, 182, 1), rgba(156, 184, 226, 1), rgba(133, 214, 202, 1), rgba(172, 236, 173, 1));\n    animation: velvet-prism-bg 20.15s ease-in-out infinite alternate;\n    backdrop-filter: saturate(145%) hue-rotate(-128deg);\n}\n\nbody::before {\n    inset: -12vh;\n    background: radial-gradient(circle, rgba(194, 198, 177, 1.00) 0%, transparent 64%);\n    filter: blur(48px);\n    mix-blend-mode: screen;\n    animation: velvet-prism-orb 27.04s ease-in-out infinite alternate;\n    opacity: 0.32;\n}\n\nbody::after {\n    background: linear-gradient(30deg, transparent 0 28%, rgba(147, 196, 216, 1.00) 48%, transparent 72%);\n    mix-blend-mode: color-dodge;\n    animation: velvet-prism-scan 14.34s linear infinite;\n    opacity: 0.22;\n}\n\n.mes, .mesText, .swipe-message {\n    background: linear-gradient(135deg, rgba(107, 6, 54, 0.68), rgba(7, 115, 99, 0.7));\n    border: 1px solid rgba(16, 72, 158, 0.88);\n    box-shadow: 0 0 34px rgba(226, 141, 182, 1);\n    backdrop-filter: blur(6.1px) saturate(180%);\n    transform-style: preserve-3d;\n    transition: transform 0.6s ease, box-shadow 0.6s ease;\n}\n\n.mes:hover {\n    transform: translateY(-6px) rotateX(2.22deg) rotateY(-0.28deg) scale(1.02);\n    box-shadow: 0 18px 48px rgba(133, 214, 202, 1);\n}\n\n.chat_mes_block .mes_text p code {\n    background: rgba(0, 0, 0, 0.45);\n    color: rgba(133, 214, 202, 1);\n    border-radius: 8px;\n    padding: 2px 6px;\n    box-shadow: 0 0 18px rgba(226, 141, 182, 1);\n}\n\n.chat_mes_block .mes_text blockquote {\n    border-left: 3px solid rgba(133, 214, 202, 1);\n    background: rgba(0, 0, 0, 0.32);\n    box-shadow: inset 0 0 18px rgba(226, 141, 182, 1);\n}\n\n.mes .avatar {\n    filter: drop-shadow(0 0 12px rgba(226, 141, 182, 1));\n}\n\n::selection {\n    background: rgba(133, 214, 202, 1);\n    color: rgba(172, 236, 173, 1);\n}\n\n@keyframes velvet-prism-bg {\n    0% { transform: scale(1) translate3d(0, 0, 0); }\n    50% { transform: scale(1.06) translate3d(0.26%, 1.12%, 0); }\n    100% { transform: scale(1.12) translate3d(2.13%, -3.27%, 0); }\n}\n\n@keyframes velvet-prism-orb {\n    0% { transform: translate3d(-3%, -3%, 0) scale(1); opacity: 0.18; }\n    50% { transform: translate3d(4%, 5%, 0) scale(1.08); opacity: 0.36; }\n    100% { transform: translate3d(-2%, 6%, 0) scale(1.02); opacity: 0.24; }\n}\n\n@keyframes velvet-prism-scan {\n    0% { transform: rotate(0deg); opacity: 0.12; }\n    50% { opacity: 0.28; }\n    100% { transform: rotate(360deg); opacity: 0.12; }\n}\n\n@keyframes velvet-prism-mesh {\n    0% { transform: translateY(-4%) scale(1); opacity: 0.2; }\n    50% { transform: translateY(4%) scale(1.06); opacity: 0.32; }\n    100% { transform: translateY(-6%) scale(1.02); opacity: 0.24; }\n}",
    "bogus_folders": true,
    "zoomed_avatar_magnification": false,
    "reduced_motion": false,
    "compact_input_area": false,
    "toastr_position": "toast-bottom-left",
    "show_swipe_num_all_messages": true,
    "click_to_edit": true,
    "notes": "Generatively enhanced CSS from update_theme_css.py"
}
